"Single Room at Wangsa Maju, Setapak","kuala_lumpur","Wangsa Maju, Setapak","RM 370.00","2019-07-26","25/07/2019","7","7429565"
"Single Room at Villa Puteri, Putra","kuala_lumpur","Villa Puteri, Putra","RM 600.00","2019-07-26","25/07/2019","7","7429613"
"Middle Room at Platinum Lake PV16, Setapak","kuala_lumpur","Platinum Lake PV16, Setapak","RM 460.00","2019-07-26","25/07/2019","7","7429633"
"Small Room at Midfields 2, Sungai Besi","kuala_lumpur","Midfields 2, Sungai Besi","RM 550.00","2019-07-26","25/07/2019","7","7419001"
"[USCI] Single Room at Taman Taynton View, Cheras","kuala_lumpur","Taman Taynton View, Cheras","RM 380.00","2019-07-26","25/07/2019","7","7427561"
"????LRT / MRT / Aeon / Velocity / IKEA???RM260????","kuala_lumpur","Taman Maluri, Cheras","RM 260.00","2019-07-26","25/07/2019","7","7429083"
"Middle Room at Prima Setapak I, Setapak","kuala_lumpur","Prima Setapak I, Setapak","RM 650.00","2019-07-26","25/07/2019","7","7429678"
"Rafflesia condo, Middle Room at Bandar Baru Sentul, Kuala Lumpur","kuala_lumpur","Sentul, Kuala Lumpur","RM 600.00","2019-07-26","25/07/2019","7","7429576"
"Master Room Availabe for Rent at Desa Putra Condo - Near to LRT Only 1 min Walking Distance","kuala_lumpur","Desa Putra, Wangsa Maju","RM 1000.00","2019-07-26","25/07/2019","7","7429493"
"Studio at Jalan Ampang, near Great Eastern Mall","kuala_lumpur","Ampang Hilir, Kuala Lumpur","RM 1750.00","2019-07-26","25/07/2019","7","7429511"
"Middle Room at Putra Suria Residence, Bandar Sri Permaisuri","kuala_lumpur","Putra Suria Residence, Bandar Sri Permaisuri","RM 550.00","2019-07-26","25/07/2019","7","7429611"
"Master Room at Fortune Avenue, Kepong","kuala_lumpur","Fortune Avenue, Kepong","RM 700.00","2019-07-26","25/07/2019","7","7429619"
"Middle Room at Jalan Genting Klang, Setapak","kuala_lumpur","Jalan Genting Klang, Setapak","RM 750.00","2019-07-26","25/07/2019","7","7429547"
"Master Room at Sri Putramas II, Dutamas","kuala_lumpur","Sri Putramas II, Dutamas","RM 800.00","2019-07-26","25/07/2019","7","7429645"
"Middle Room at Seri Maya, Setiawangsa","kuala_lumpur","Seri Maya, Setiawangsa","RM 680.00","2019-07-26","25/07/2019","7","7429531"
"Luxury Room @ Bangsar / BSC / DC Mall for rent F/F","kuala_lumpur","Bangsar, Kuala Lumpur","RM 870.00","2019-07-26","25/07/2019","7","7429560"
"Master Room at Villa Wangsamas, Wangsa Maju","kuala_lumpur","Villa Wangsamas, Wangsa Maju","RM 650.00","2019-07-26","25/07/2019","7","7429673"
"???? LRT / MRT / Aeon / Velocity / IKEA????RM180????","kuala_lumpur","Taman Maluri, Cheras","RM 180.00","2019-07-26","25/07/2019","7","7364032"
"Single Room at Wangsa Maju, Setapak","kuala_lumpur","Wangsa Maju, Setapak","RM 500.00","2019-07-26","25/07/2019","7","7429658"
"Middle Room at Taman Connaught, Cheras","kuala_lumpur","Taman Connaught, Cheras","RM 480.00","2019-07-26","24/07/2019","7","7408444"
"Middle Room at Greenview Apartments, Kepong","kuala_lumpur","Greenview Apartments, Kepong","RM 320.00","2019-07-26","24/07/2019","7","7429492"
"Master Room at Bukit Jalil, Kuala Lumpur","kuala_lumpur","Bukit Jalil, Kuala Lumpur","RM 700.00","2019-07-26","24/07/2019","7","7429489"
"Master Room at The Henge, Kepong","kuala_lumpur","The Henge, Kepong","RM 900.00","2019-07-26","24/07/2019","7","7429399"
"Single Room at Brickfields, KL City Centre","kuala_lumpur","Brickfields, KL City Centre","RM 650.00","2019-07-26","24/07/2019","7","7429483"
"Middle Room at Bukit Jalil, Kuala Lumpur","kuala_lumpur","Bukit Jalil, Kuala Lumpur","RM 670.00","2019-07-26","24/07/2019","7","7425740"
"Single Room at OUG Parklane, Old Klang Road","kuala_lumpur","OUG Parklane, Old Klang Road","RM 600.00","2019-07-26","24/07/2019","7","7429471"
"Middle Room at Setiawangsa, Kuala Lumpur","kuala_lumpur","Setiawangsa, Kuala Lumpur","RM 250.00","2019-07-26","24/07/2019","7","7429435"
"F.Furnitured Master Room for Rent - Casa Green, Bukit Jalil (7min walk to LRT Muhibah)","kuala_lumpur","Old Klang Road, Kuala Lumpur","RM 750.00","2019-07-26","24/07/2019","7","7429457"
"Private Room at Cheras Alam Damai, Near Taman Connaught & WIFI","kuala_lumpur","Cheras, Kuala Lumpur","RM 550.00","2019-07-26","24/07/2019","7","7353262"
"Middle Room at Bukit Jalil, Kuala Lumpur","kuala_lumpur","Bukit Jalil, Kuala Lumpur","RM 750.00","2019-07-26","24/07/2019","7","7351452"
"Soho at PV15, Rental Inclusive Water & Electricity Charges, Near Setapak Central & KLCC","kuala_lumpur","Platinum Lake PV15, Setapak","RM 750.00","2019-07-26","24/07/2019","7","7429432"
"Room Rent Bangsar Park, Bangsar Baru, >5Mins by Bus to Stesen Putra LRT Bangsar & High Speedy WIFI","kuala_lumpur","Bangsar, Kuala Lumpur","RM 650.00","2019-07-26","24/07/2019","7","7353590"
"Middle Room at Kuchai Lama, Kuala Lumpur","kuala_lumpur","Kuchai Lama, Kuala Lumpur","RM 188.00","2019-07-26","24/07/2019","7","7429456"
"Master Room at Wangsa Metroview","kuala_lumpur","Wangsa Maju, Setapak","RM 600.00","2019-07-26","24/07/2019","7","7429446"
"Nice PV20 Medium Rooms, Move in July 2019","kuala_lumpur","Platinum Lake PV20, Setapak","RM 500.00","2019-07-26","24/07/2019","7","7429459"
"Room At Taman Connaught, Cheras Near Ucsi University , Sentral Mall & WI-FI","kuala_lumpur","Taman Connaught, Cheras","RM 540.00","2019-07-26","24/07/2019","7","7353221"
"Middle Room at Sentul, Kuala Lumpur","kuala_lumpur","Sentul, Kuala Lumpur","RM 250.00","2019-07-26","24/07/2019","7","7429451"
"Single Room at Casa Green, Bukit Jalil","kuala_lumpur","Casa Green, Bukit Jalil","RM 650.00","2019-07-26","24/07/2019","7","7429447"
"Single Room at The Holmes, Bandar Tun Razak","kuala_lumpur","The Holmes, Bandar Tun Razak","RM 600.00","2019-07-26","24/07/2019","7","7429429"
"F.Furnitured Room for Rent - Casa Green, Bukit Jalil (7min walk to LRT Muhibah)","kuala_lumpur","Bukit Jalil, Kuala Lumpur","RM 750.00","2019-07-26","24/07/2019","7","7429441"
"Middle Room at Setiawangsa, Kuala Lumpur","kuala_lumpur","Setiawangsa, Kuala Lumpur","RM 300.00","2019-07-26","24/07/2019","7","7429445"
"Middle Room at Midfields, Sungai Besi","kuala_lumpur","Midfields, Sungai Besi","RM 630.00","2019-07-26","24/07/2019","7","7425481"
"Single Room at Wangsa Maju, Setapak","kuala_lumpur","Wangsa Maju, Setapak","RM 350.00","2019-07-26","24/07/2019","7","7429438"
"Twin Beds Room attached with private bathroom at PV128, Setapak, walking distance to Setapak Central Mall","kuala_lumpur","Platinum Mondrian PV128, Setapak","RM 700.00","2019-07-26","24/07/2019","7","7429407"
"Middle Room at Seri Maya, Setiawangsa","kuala_lumpur","Seri Maya, Setiawangsa","RM 950.00","2019-07-26","24/07/2019","7","7429412"
"Available Rooms rent with Great Location at Bukit Jalil with High Speed Wifi","kuala_lumpur","Mutiara Bukit Jalil, Bukit Jalil","RM 660.00","2019-07-26","24/07/2019","7","7349993"
"Middle Room at Fortune Court, Kepong","kuala_lumpur","Fortune Court, Kepong","RM 600.00","2019-07-26","24/07/2019","7","7429327"
"Medium Room at Prima Setapak","kuala_lumpur","Prima Setapak I, Setapak","RM 450.00","2019-07-26","24/07/2019","7","7370079"
"Studio at The Regalia, Putra, Walking Distance to LRT Putra and Sunway Putra Mall","kuala_lumpur","Regalia, Putra","RM 1800.00","2019-07-26","24/07/2019","7","7429413"
"Master Room at Seri Maya, Setiawangsa","kuala_lumpur","Seri Maya, Setiawangsa","RM 1350.00","2019-07-26","24/07/2019","7","7429352"
"??,??,???PRIMA SETAPAK CONDO Middle Room at Setapak, Kuala Lumpur","kuala_lumpur","Setapak, Kuala Lumpur","RM 500.00","2019-07-26","24/07/2019","7","7429073"
"Room at Suasana Sentral Condominium, KL Sentral","kuala_lumpur","Suasana Sentral Condominium, KL Sentral","RM 1100.00","2019-07-26","24/07/2019","7","7429420"
"Studio at Cheras, Kuala Lumpur","kuala_lumpur","Cheras, Kuala Lumpur","RM 1350.00","2019-07-26","24/07/2019","7","7429325"
"Middle Room at Seri Maya, Setiawangsa","kuala_lumpur","Seri Maya, Setiawangsa","RM 1000.00","2019-07-26","24/07/2019","7","7429416"
"Medium Room attached with bathroom at PV15, Rental Inclusive Water & Elec Charges, Near TARUC & Setapak Central, Prefer Chinese student","kuala_lumpur","Platinum Lake PV15, Setapak","RM 550.00","2019-07-26","24/07/2019","7","7429410"
"Middle Room at Tiara Mutiara 2, Old Klang Road","kuala_lumpur","Tiara Mutiara 2, Old Klang Road","RM 550.00","2019-07-26","24/07/2019","7","7429408"
"F.Furnished Medium Room at You Vista, Cheras (3min walking to MRT Suntex), UCSI, Velocity, B.Bintang, KL Sentral","kuala_lumpur","KL Sentral, KL City Centre","RM 600.00","2019-07-26","24/07/2019","7","7429336"
"Middle Room at Taman Setapak Indah, Setapak","kuala_lumpur","Taman Setapak Indah, Setapak","RM 250.00","2019-07-26","24/07/2019","7","7429401"
"Single Room at Old Klang Road, Kuala Lumpur","kuala_lumpur","Old Klang Road, Kuala Lumpur","RM 400.00","2019-07-26","24/07/2019","7","7429199"
"Fully Furnished Master Room with private bathroom at Old Klang Road, Kuala Lumpur","kuala_lumpur","Old Klang Road, Kuala Lumpur","RM 1150.00","2019-07-26","24/07/2019","7","7429288"
"Zetapark Masterbedroom with Aircond Private Balcony above Setapak Central Mall","kuala_lumpur","The Loft, Setapak","RM 850.00","2019-07-26","24/07/2019","7","7429262"
"Medium Bedroom at Sentral Residence","kuala_lumpur","KL Sentral, KL City Centre","RM 680.00","2019-07-26","24/07/2019","7","7429285"
"Middle Room at Menara Orkid, Sentul","kuala_lumpur","Menara Orkid, Sentul","RM 250.00","2019-07-26","24/07/2019","7","7429385"
"Middle Room at Bangsar South, Pantai","kuala_lumpur","Bangsar South, Pantai","RM 144.00","2019-07-26","24/07/2019","7","7424747"
"Bukit Jalil Available Room For Rent With Free High Speed WIFI","kuala_lumpur","Bukit Jalil, Kuala Lumpur","RM 670.00","2019-07-26","24/07/2019","7","7381790"
"PV13 Condo Setapak KL Master Bedroom Near PV128 LRT Wangsa Maju","kuala_lumpur","Platinum Lake PV13, Setapak","RM 600.00","2019-07-26","24/07/2019","7","7429249"
"Master Room at Wangsa Maju, Setapak","kuala_lumpur","Wangsa Maju, Setapak","RM 300.00","2019-07-26","24/07/2019","7","7426890"
"BALCONY ROOM & 3MINS WALKING TO LRT & KLCC-AMPANG PARK- KL SENTRAL","kuala_lumpur","KLCC, KL City Centre","RM 900.00","2019-07-26","24/07/2019","7","7429320"
"Middle Room, own toilet and car park at Scenaria North Kiara Hills","kuala_lumpur","Segambut, Kuala Lumpur","RM 900.00","2019-07-26","24/07/2019","7","7428815"
"Single Room at Cheras, Kuala Lumpur","kuala_lumpur","Cheras, Kuala Lumpur","RM 350.00","2019-07-26","24/07/2019","7","7428801"
"3 Sty Super Link @ Lake Fields, Sg Besi, TBS, Fully Furnished With Air-Cond","kuala_lumpur","Sungai Besi, Kuala Lumpur","RM 499.00","2019-07-26","24/07/2019","7","7428015"
"Middle Room at Rafflesia Sentul Condominium, Sentul","kuala_lumpur","Rafflesia Sentul Condominium, Sentul","RM 400.00","2019-07-26","24/07/2019","7","7429239"
"Master Room at Menara Orkid, Sentul","kuala_lumpur","Menara Orkid, Sentul","RM 260.00","2019-07-26","24/07/2019","7","7429395"
"Middle Room at Danau Kota Suite Apartments, Setapak, Walking Distance to Setapak Central Mall","kuala_lumpur","Setapak, Kuala Lumpur","RM 650.00","2019-07-26","24/07/2019","7","7429406"
"Master Room at Rafflesia Sentul Condominium, Sentul","kuala_lumpur","Rafflesia Sentul Condominium, Sentul","RM 450.00","2019-07-26","24/07/2019","7","7429242"
"Suite at Maxim Citilights, Sentul","kuala_lumpur","Maxim Citilights, Sentul","RM 1100.00","2019-07-26","24/07/2019","7","7428975"
"Available Room For Rent with Private bathroom at Bukit Jalil , with Aircon & Internet Near LRT","kuala_lumpur","Bukit Jalil, Kuala Lumpur","RM 660.00","2019-07-26","24/07/2019","7","7347814"
"Studio at VERVE Suites, Mont Kiara","kuala_lumpur","VERVE Suites, Mont Kiara","RM 2300.00","2019-07-26","24/07/2019","7","7398831"
"Master Room at Cheras, Kuala Lumpur","kuala_lumpur","Cheras, Kuala Lumpur","RM 650.00","2019-07-26","24/07/2019","7","7429100"
"FEMALE ROOM & 3MINS WALKING TO LRT & Near KLCC- AMPANG PARK- KL SENTRAL","kuala_lumpur","KLCC, KL City Centre","RM 850.00","2019-07-26","24/07/2019","7","7429318"
"Single Room at South View, Bangsar South","kuala_lumpur","South View, Bangsar South","RM 1100.00","2019-07-26","24/07/2019","7","7422671"
"Single Room at Danau Kota, Setapak","kuala_lumpur","Danau Kota, Setapak","RM 650.00","2019-07-26","24/07/2019","7","7429355"
"Single Room at Danau Kota, Setapak","kuala_lumpur","Danau Kota, Setapak","RM 700.00","2019-07-26","24/07/2019","7","7429238"
"Middle Room at Cheras, Kuala Lumpur","kuala_lumpur","Cheras, Kuala Lumpur","RM 500.00","2019-07-26","24/07/2019","7","7429093"
"PV3 Condo (Fully Furnished Room) @ LRT Taman Melati","kuala_lumpur","Platinum Hill PV3, Setapak","RM 680.00","2019-07-26","24/07/2019","7","7429180"
"Master Room at One-Stop, Pudu","kuala_lumpur","One-Stop, Pudu","RM 1050.00","2019-07-26","24/07/2019","7","7429328"
"Middle Room at OUG Parklane, Old Klang Road","kuala_lumpur","OUG Parklane, Old Klang Road","RM 650.00","2019-07-26","24/07/2019","7","7429383"
"Middle Room For Rent To Let At TTDI, Kuala Lumpur Near One Utama & Damansara & Speedy Wifi","kuala_lumpur","TTDI, Kuala Lumpur","RM 580.00","2019-07-26","24/07/2019","7","7392505"
"Middle Room at Cheras, Kuala Lumpur","kuala_lumpur","Cheras, Kuala Lumpur","RM 500.00","2019-07-26","24/07/2019","7","7429043"
"Middle Room Available for Rent at Desa Putra Condo - Near to LRT Only 1 min Walking Distance","kuala_lumpur","Desa Putra, Wangsa Maju","RM 800.00","2019-07-26","24/07/2019","7","7429391"
"Spacious & Furnished 2nd Bedroom at Aston Kiara 3, Mont Kiara","kuala_lumpur","Aston Kiara 3, Mont Kiara","RM 1000.00","2019-07-26","24/07/2019","7","7428625"
"Middle Room at Setapak Green, Setapak","kuala_lumpur","Setapak Green, Setapak","RM 480.00","2019-07-26","24/07/2019","7","7428890"
"Fully Furnished Middle Room Nearby LRT in South View Bangsar South","kuala_lumpur","South View, Bangsar South","RM 1300.00","2019-07-26","24/07/2019","7","7400113"
"Master Room at Condo Anjung Villa, BB Sentul","kuala_lumpur","Sentul, Kuala Lumpur","RM 700.00","2019-07-26","24/07/2019","7","7429316"
"Middle Room At Bukit Jalil, Kuala Lumpur & Full Facilities & Free High Speed WI-FI","kuala_lumpur","Mutiara Bukit Jalil, Bukit Jalil","RM 660.00","2019-07-26","24/07/2019","7","7381755"
"medium room included utility fee the henge kepong","kuala_lumpur","Kepong, Kuala Lumpur","RM 720.00","2019-07-26","24/07/2019","7","7428888"
"Middle Room at Gaya Bangsar, Bangsar","kuala_lumpur","Gaya Bangsar, Bangsar","RM 700.00","2019-07-26","24/07/2019","7","7429315"
"Middle Room Rent At Bukit Jalil, Kuala Lumpur & Fully Facilities & Clean","kuala_lumpur","Bukit Jalil, Kuala Lumpur","RM 670.00","2019-07-26","24/07/2019","7","7381752"
"[2 IN 1] Middle Room at Rafflesia Sentul Condominium, Sentul","kuala_lumpur","Rafflesia Sentul Condominium, Sentul","RM 400.00","2019-07-26","24/07/2019","7","7429246"
"Middle Room at Taman Desa, Kuala Lumpur","kuala_lumpur","Taman Desa, Kuala Lumpur","RM 450.00","2019-07-26","24/07/2019","7","7429195"
"Middle Room at Maxim Citilights, Sentul","kuala_lumpur","Maxim Citilights, Sentul","RM 500.00","2019-07-26","24/07/2019","7","7429359"
"Middle Room at Setapak, Kuala Lumpur","kuala_lumpur","Setapak, Kuala Lumpur","RM 400.00","2019-07-26","24/07/2019","7","7429172"
"Master Room at Wangsa Maju, Setapak","kuala_lumpur","Wangsa Maju, Setapak","RM 450.00","2019-07-26","24/07/2019","7","7429003"
"SMALL ROOM with CARPARK @ kl palace court FREE WIFI & CLEANING","kuala_lumpur","Old Klang Road, Kuala Lumpur","RM 450.00","2019-07-26","24/07/2019","7","7429165"
"Master Room at Setapak Green, Setapak","kuala_lumpur","Setapak Green, Setapak","RM 880.00","2019-07-26","24/07/2019","7","7428887"
"{NEAT & TIDY} Middle Room at Rafflesia Sentul Condominium, Sentul","kuala_lumpur","Rafflesia Sentul Condominium, Sentul","RM 400.00","2019-07-26","24/07/2019","7","7429248"
"Single Room at Cheras, Kuala Lumpur","kuala_lumpur","Cheras, Kuala Lumpur","RM 450.00","2019-07-26","24/07/2019","7","7429274"
"Small Bedroom at Sentral Residence","kuala_lumpur","KL Sentral, KL City Centre","RM 500.00","2019-07-26","24/07/2019","7","7429283"
"[NEW FURNITURE] Middle Room at Rafflesia Sentul Condominium, Sentul","kuala_lumpur","Rafflesia Sentul Condominium, Sentul","RM 400.00","2019-07-26","24/07/2019","7","7415351"
"Master Room at Permata Residences, Cheras","kuala_lumpur","Permata Residences, Cheras","RM 750.00","2019-07-26","24/07/2019","7","7429261"
"Bilik sharing selesa rumah bersih di AU 3/28 Ampang, Depan bus stop, 15min ke KLCC,","kuala_lumpur","Keramat, Kuala Lumpur","RM 250.00","2019-07-26","24/07/2019","7","7394118"
"Larger Middle Room at Plaza Medan Putra Menjalara","kuala_lumpur","Plaza Medan Putra, Bandar Menjalara","RM 500.00","2019-07-26","24/07/2019","7","7409404"
"Room For Rent at TTDI with Free Wifi, FullY Facilities Available Rent","kuala_lumpur","TTDI, Kuala Lumpur","RM 630.00","2019-07-26","24/07/2019","7","7347662"
"Middle Room at Bangsar South, Pantai","kuala_lumpur","Bangsar South, Pantai","RM 130.00","2019-07-26","24/07/2019","7","7429271"
""FEMALE Unit" Medium Room @ ZetaPark, Setapak","kuala_lumpur","Jalan Genting Klang, Setapak","RM 700.00","2019-07-26","24/07/2019","7","7429113"
"Desa Pandan Ala-Hotel Male Room, Kuala Lumpur","kuala_lumpur","Desa Pandan, Kuala Lumpur","RM 370.00","2019-07-26","24/07/2019","7","7391516"
"Middle Room at Kiara Residence, Bukit Jalil","kuala_lumpur","Kiara Residence, Bukit Jalil","RM 500.00","2019-07-26","24/07/2019","7","7429273"
"Suite at Permata Residences, Cheras","kuala_lumpur","Permata Residences, Cheras","RM 1300.00","2019-07-26","24/07/2019","7","7429254"
"Single Room with Pool Gym Games room at Link 2, Bukit Jalil","kuala_lumpur","Bukit Jalil, Kuala Lumpur","RM 650.00","2019-07-26","24/07/2019","7","7429007"
"Queen Room @ Kepong, Kuala Lumpur","kuala_lumpur","Kepong, Kuala Lumpur","RM 750.00","2019-07-26","24/07/2019","7","7429074"
"????? Single Room at Setapak, Kuala Lumpur","kuala_lumpur","Setapak, Kuala Lumpur","RM 400.00","2019-07-26","24/07/2019","7","7429067"
"Middle Room at Platinum Lake PV15, Setapak","kuala_lumpur","Platinum Lake PV15, Setapak","RM 550.00","2019-07-26","24/07/2019","7","7429264"
"Middle Room at Titiwangsa Sentral, Titiwangsa","kuala_lumpur","Titiwangsa Sentral, Titiwangsa","RM 850.00","2019-07-26","24/07/2019","7","7429228"
"Full furnished With Wi-fi & Aircond Available Room at Mutiara Bukit Jalil","kuala_lumpur","Bukit Jalil, Kuala Lumpur","RM 660.00","2019-07-26","24/07/2019","7","7350057"
"Middle Room with Aircond at Zen Suites @ ZetaPark, Setapak","kuala_lumpur","Zen Suites @ ZetaPark, Setapak","RM 600.00","2019-07-26","24/07/2019","7","7429255"
"Finding Roomate at Middle Room @D'Mayang Condominium, walking distance to KLCC","kuala_lumpur","D'Mayang, KLCC","RM 700.00","2019-07-26","24/07/2019","7","7429286"
"Master Room at Wangsa Maju, Setapak","kuala_lumpur","Wangsa Maju, Setapak","RM 360.00","2019-07-26","24/07/2019","7","7429167"
"Middle Room at OUG Parklane, Old Klang Road","kuala_lumpur","OUG Parklane, Old Klang Road","RM 450.00","2019-07-26","24/07/2019","7","7428751"
"PV5 Condo (Master Room) @ LRT Taman Melati","kuala_lumpur","Platinum Hill PV5, Setapak","RM 670.00","2019-07-26","24/07/2019","7","7429244"
"Middle Room at Platinum Lake PV10, Setapak","kuala_lumpur","Platinum Lake PV10, Setapak","RM 480.00","2019-07-26","24/07/2019","7","7429214"
"Middle Room at Platinum Lake PV20, Setapak","kuala_lumpur","Platinum Lake PV20, Setapak","RM 550.00","2019-07-26","24/07/2019","7","7429154"
"Suite at The Henge, Kepong","kuala_lumpur","The Henge, Kepong","RM 1300.00","2019-07-26","24/07/2019","7","7429001"
"Master Room at Vue Residences, Titiwangsa","kuala_lumpur","Vue Residences, Titiwangsa","RM 1250.00","2019-07-26","24/07/2019","7","7428837"
"Middle Room at SPRING AVENUE Kuchai Lama, Kuala Lumpur","kuala_lumpur","SPRING AVENUE Kuchai Lama, Kuala Lumpur","RM 750.00","2019-07-26","24/07/2019","7","7429044"
"{SELESA DAN MUDAH} Middle Room at Rafflesia Sentul Condominium, Sentul","kuala_lumpur","Rafflesia Sentul Condominium, Sentul","RM 400.00","2019-07-26","24/07/2019","7","7429229"
"Middle Room at Kuchai Lama, Kuala Lumpur","kuala_lumpur","Kuchai Lama, Kuala Lumpur","RM 550.00","2019-07-26","24/07/2019","7","7429041"
"[AUGUST iNTAKE] Master Bedroom Attached Toilet at Rafflesia Sentul Condominium, Sentul","kuala_lumpur","Rafflesia Sentul Condominium, Sentul","RM 450.00","2019-07-26","24/07/2019","7","7416807"
"{SINGLE GIRL} Master Room at Rafflesia Sentul Condominium, Sentul","kuala_lumpur","Rafflesia Sentul Condominium, Sentul","RM 450.00","2019-07-26","24/07/2019","7","7429236"
"Master Room at Old Klang Road, Kuala Lumpur","kuala_lumpur","Old Klang Road, Kuala Lumpur","RM 700.00","2019-07-26","24/07/2019","7","7428708"
"Bukit Jalil Medium Room nice facilities Astro, TPM, APU, 15 mins KL, free wifi, 5mins drive LRT","kuala_lumpur","Bukit Jalil, Kuala Lumpur","RM 750.00","2019-07-26","24/07/2019","7","7405462"
"[FULLY FURNISHED] WIfi included Master Room at Rafflesia Sentul Condominium, Sentul","kuala_lumpur","Rafflesia Sentul Condominium, Sentul","RM 450.00","2019-07-26","24/07/2019","7","7429225"
"Master Room at Hartamas Regency 2, Dutamas","kuala_lumpur","Hartamas Regency 2, Dutamas","RM 1500.00","2019-07-26","24/07/2019","7","7429112"
"Master Room at Happy Garden Flat, Kuchai Lama","kuala_lumpur","Happy Garden Flat, Kuchai Lama","RM 135.00","2019-07-26","24/07/2019","7","7428922"
"Luxury Middle Room at Trinity Aquata, Sungai Besi With Reasonable Price","kuala_lumpur","Trinity Aquata, Sungai Besi","RM 750.00","2019-07-26","24/07/2019","7","7428813"
"Middle Room at 1 Petaling, Sungai Besi","kuala_lumpur","1 Petaling, Sungai Besi","RM 450.00","2019-07-26","24/07/2019","7","7428613"
"Dsands Residence Old Klang Road, Female rooms 4 rent, FOC ELECTRIC, WATER, WIFI, cleaning","kuala_lumpur","D'Sands Residence, Old Klang Road","RM 870.00","2019-07-26","24/07/2019","7","7408306"
"Middle Room at Kuala Lumpur, Malaysia","kuala_lumpur","Kuala Lumpur, Malaysia","RM 500.00","2019-07-26","24/07/2019","7","7429149"
"Small Room at Platinum Lake PV15, Setapak","kuala_lumpur","Platinum Lake PV15, Setapak","RM 390.00","2019-07-26","24/07/2019","7","7429104"
"Single Room at The Rainz, Bukit Jalil","kuala_lumpur","The Rainz, Bukit Jalil","RM 600.00","2019-07-26","24/07/2019","7","7420048"
"Middle Room at Midfields 2, Sungai Besi","kuala_lumpur","Midfields 2, Sungai Besi","RM 600.00","2019-07-26","24/07/2019","7","7424937"
"Middle Room at Bayu Tasik 1 Condominium","kuala_lumpur","Cheras, Kuala Lumpur","RM 550.00","2019-07-26","24/07/2019","7","7429219"
"Middle Room at Platinum Lake PV15, Setapak","kuala_lumpur","Platinum Lake PV15, Setapak","RM 600.00","2019-07-26","24/07/2019","7","7387105"
"Middle Room at Platinum Lake PV15, Setapak","kuala_lumpur","Platinum Lake PV15, Setapak","RM 550.00","2019-07-26","24/07/2019","7","7393334"
"Middle Room at Rafflesia Sentul Condominium, Sentul","kuala_lumpur","Rafflesia Sentul Condominium, Sentul","RM 400.00","2019-07-26","24/07/2019","7","7416801"
"Middle Room at Desa Setapak, Setapak","kuala_lumpur","Desa Setapak, Setapak","RM 350.00","2019-07-26","24/07/2019","7","7428973"
"Middle Room at The Petalz, Old Klang Road","kuala_lumpur","The Petalz, Old Klang Road","RM 850.00","2019-07-26","24/07/2019","7","7426467"
"Master Room at Old Klang Road, Kuala Lumpur","kuala_lumpur","Old Klang Road, Kuala Lumpur","RM 700.00","2019-07-26","24/07/2019","7","7429197"
"Syed Putra (Mid Valley), New, Nice & Interior Designed Fully Furnished Room + Private Attached Bathroom (Free Utilities & WiFi)","kuala_lumpur","Old Klang Road, Kuala Lumpur","RM 1000.00","2019-07-26","24/07/2019","7","7429086"
"Master Room at Le Yuan Residence, Kuchai Lama","kuala_lumpur","Le Yuan Residence, Kuchai Lama","RM 1200.00","2019-07-26","24/07/2019","7","7428907"
"PV16 Master Room for Rent (Move-in NOW)","kuala_lumpur","Platinum Lake PV16, Setapak","RM 700.00","2019-07-26","24/07/2019","7","7429088"
"Fully Furnished Middle Room at Suasana Lumayan, Bandar Sri Permaisuri","kuala_lumpur","Suasana Lumayan, Bandar Sri Permaisuri","RM 550.00","2019-07-26","24/07/2019","7","7428880"
"Low Price Master Room at Trinity Aquata, Sungai Besi (Near to TBS)","kuala_lumpur","Trinity Aquata, Sungai Besi","RM 950.00","2019-07-26","24/07/2019","7","7429090"
"Studio at The Signature, Sri Hartamas","kuala_lumpur","The Signature, Sri Hartamas","RM 2100.00","2019-07-26","24/07/2019","7","7429143"
"Bangsar, Nice & Interior Designed Fully Furnished Room + Private Attached Bathroom (Free Utilities & WiFi)","kuala_lumpur","Bangsar, Kuala Lumpur","RM 1200.00","2019-07-26","24/07/2019","7","7428416"
"(FREE WIFI & UTILITIES & SHUTTLE BUS)Medium Room The Andes,Bukit Jalil","kuala_lumpur","The Andes, Bukit Jalil","RM 800.00","2019-07-26","24/07/2019","7","7428189"
"Middle Room at Kuchai Lama, Kuala Lumpur","kuala_lumpur","Kuchai Lama, Kuala Lumpur","RM 550.00","2019-07-26","24/07/2019","7","7424414"
"Full furnished Medium Room with Air-con, 10 mins walk to LRT station (all-girls unit)","kuala_lumpur","The Parc Tower, Setapak","RM 750.00","2019-07-26","24/07/2019","7","7428960"
"Master Room at Bangsar, Kuala Lumpur","kuala_lumpur","Bangsar, Kuala Lumpur","RM 1300.00","2019-07-26","24/07/2019","7","7409216"
"Middle Room at Zamrud Apartment, Old Klang Road","kuala_lumpur","Zamrud Apartment, Old Klang Road","RM 500.00","2019-07-26","24/07/2019","7","7428998"
"Middle Room at Platinum Lake PV16, Setapak","kuala_lumpur","Platinum Lake PV16, Setapak","RM 500.00","2019-07-26","24/07/2019","7","7429156"
"Master Room at Suasana Lumayan, Bandar Sri Permaisuri","kuala_lumpur","Suasana Lumayan, Bandar Sri Permaisuri","RM 250.00","2019-07-26","24/07/2019","7","7429030"
"Bukit Jalil, The Andes Condo (INCLUDING UTILITIES, WIFI, CARPARK)","kuala_lumpur","The Andes, Bukit Jalil","RM 1400.00","2019-07-26","24/07/2019","7","7425976"
