"NEW PREMIUM ROOM!!! : EXCLUSIVE : FULL FURNISHED AND HILLY VIEW AT THE ZIZZ, DAMANSARA DAMAI","selangor","Bandar Utama, Petaling Jaya","RM 600.00","2019-07-26","25/07/2019","7","7428455"
"Middle Room at Bandar Sunway, Petaling Jaya","selangor","Bandar Sunway, Petaling Jaya","RM 650.00","2019-07-26","25/07/2019","7","7427834"
"Bandar Sunway PJS 10 PJS 5 Near with Sunway Pyramid & Free High Speed Wifi","selangor","PJS 10, Bandar Sunway","RM 550.00","2019-07-26","25/07/2019","7","7361743"
"Fully Facilitise SS2 Aircon Available Big Room Rent & High Speed WI-FI","selangor","SS2, Petaling Jaya","RM 580.00","2019-07-26","25/07/2019","7","7356792"
"[ NEAR TO MRT SUNGAI BULOH ]: AFFORDABLE COMFY & COSY SINGLE ROOM AT THE ZIZZ, CONDOMINIUM. RENTAL INDLUDED UTILITIES","selangor","Petaling Jaya, Selangor","RM 600.00","2019-07-26","25/07/2019","7","7428457"
"Room For Rent At SS15, Near INTI College With Free Wifi","selangor","SS15, Subang Jaya","RM 550.00","2019-07-26","25/07/2019","7","7353638"
"Room Rent at Putra Heights Subang Jaya Near LRT, Taman Alam Megah With Weekly Cleaning","selangor","Putra Heights, Subang Jaya","RM 550.00","2019-07-26","25/07/2019","7","7349521"
"[EXECUTIVE] A Premium Single Room with PRIVATE TV in Each Room and HILLY View@ The Zizz, Damansara Damai, Petaling Jaya","selangor","Kota Damansara, Petaling Jaya","RM 550.00","2019-07-26","25/07/2019","7","7427439"
"Middle Room Puri Aiyu (Sek22)","selangor","Shah Alam, Selangor","RM 520.00","2019-07-26","25/07/2019","7","5255980"
"[ NEAR TO KTM/MRT SUNGAI BULOH ]: AFFORDABLE COMFY & COZY SINGLE ROOM AT THE ZIZZ, CONDOMINIUM. RENTAL INDLUDED UTILITIES","selangor","Damansara Damai, Petaling Jaya","RM 550.00","2019-07-26","25/07/2019","7","7428876"
"SUPERIOR ROOM!!! : [THE ZIZZ CONDO] : NEAR KTM & KTM SUNGAI BULUH WITH PRIVATE TV !!","selangor","Bandar Utama, Petaling Jaya","RM 600.00","2019-07-26","25/07/2019","7","7428734"
"100Mbps Wifi at Taman Wawasan, Pusat Bandar Puchong","selangor","Taman Wawasan, Pusat Bandar Puchong","RM 550.00","2019-07-26","25/07/2019","7","7429725"
"[FREE HIGHSPEED WIFI] Near to MRT/KTM Sungai Buloh, A Premium Single Room ,Rental INCLUDED Utilities @ The Zizz,Damansara Damai,Petaling Jaya","selangor","Damansara Damai, Petaling Jaya","RM 600.00","2019-07-26","25/07/2019","7","7427416"
"[ NEAR TO KTM/MRT SUNGAI BULOH ]: PRIVATE SINGLE ROOM WITH FULL FURNISHED AT THE ZIZZ, CONDOMINIUM. RENTAL INDLUDED UTILITIES","selangor","Petaling Jaya, Selangor","RM 550.00","2019-07-26","25/07/2019","7","7428871"
"Koi kinrara Rooms for lets","selangor","Puchong, Selangor","RM 600.00","2019-07-26","25/07/2019","7","5843650"
"Room For Rent At SS2 with High Speed WiFi, Full Facilitise","selangor","SS2, Petaling Jaya","RM 600.00","2019-07-26","25/07/2019","7","7371664"
"PJS 10 & PJS 5 at Bandar Sunway Nearby Sunway Mentari, Sunway Pyramid With WIFI","selangor","PJS 10, Bandar Sunway","RM 580.00","2019-07-26","25/07/2019","7","7415729"
"Non-smoking Unit at Sea Park , Petaling Jaya With Wi-fi, Cleaning Service","selangor","Sea Park, Petaling Jaya","RM 700.00","2019-07-26","25/07/2019","7","7424191"
"USJ Subang Middle Room For Rent, Near Da Men Mall, Summit With Wi-fi","selangor","UEP Subang Jaya, Subang Jaya","RM 590.00","2019-07-26","25/07/2019","7","7352000"
"USJ Room For Rent At Subang With Full Facilitise & Wi-fi","selangor","UEP Subang Jaya, Subang Jaya","RM 590.00","2019-07-26","25/07/2019","7","7348065"
"Room At SS15 Subang Jaya, Subang Parade, Empire , SS15 LRT With Free Wifi","selangor","SS15, Subang Jaya","RM 540.00","2019-07-26","25/07/2019","7","7351910"
"Master Room at Shah Alam, Selangor","selangor","Shah Alam, Selangor","RM 270.00","2019-07-26","25/07/2019","7","7429685"
"Room Rent at SS18 , Subang Jaya Walking LRT With High Speed Internet","selangor","SS18, Subang Jaya","RM 670.00","2019-07-26","25/07/2019","7","7349492"
"SUPERIOR AFFORDABLE ROOM!!! : [THE ZIZZ CONDOMINIUM] : NEAR KTM & KTM SUNGAI BULUH WITH PRIVATE TV !!","selangor","Bandar Utama, Petaling Jaya","RM 600.00","2019-07-26","25/07/2019","7","7428844"
"[EXECUTIVE] Premium Single Room with PRIVATE TV in Each Room, FREE HIGHSPEED WIFI and Swimming Pool View@ The Zizz, Damansara Damai, Petaling Jaya","selangor","Petaling Jaya, Selangor","RM 600.00","2019-07-26","25/07/2019","7","7427426"
"Middle Room Rent at SS2 , Petaling Jaya , With housecleaning weekly","selangor","SS2, Petaling Jaya","RM 590.00","2019-07-26","25/07/2019","7","7384167"
"USJ Subang Room Rent, Near Segi College, 19 USJ mall With free Wi-fi","selangor","UEP Subang Jaya, Subang Jaya","RM 590.00","2019-07-26","25/07/2019","7","7352004"
"Master Room Sharing @ Suria Ixora Apt","selangor","Suria Ixora, Setia Alam","RM 350.00","2019-07-26","25/07/2019","7","6561393"
"Middle Room at SS2, Petaling Jaya With Free High Speed WI-FI & Free Cleaning Services","selangor","SS2, Petaling Jaya","RM 650.00","2019-07-26","25/07/2019","7","7415415"
"[ NEAR TO KTM/MRT SUNGAI BULOH ]: A PRIVATE SINGLE ROOM ,FULL FURNISHED WITH NEW FURNITURE AT THE ZIZZ, CONDOMINIUM. RENTAL INDLUDED UTILITIES","selangor","Bandar Utama, Petaling Jaya","RM 600.00","2019-07-26","25/07/2019","7","7428731"
"Middle Room For Rent Near Sunway Pyramid With High Speed WIFI","selangor","Bandar Sunway, Petaling Jaya","RM 570.00","2019-07-26","25/07/2019","7","7352007"
"Middle Room Rent at Sea Park, Petaling Jaya > 3mins Walking LRT taman Paramount With Free Speedy WIFI","selangor","Sea Park, Petaling Jaya","RM 650.00","2019-07-26","25/07/2019","7","7415418"
"Middle Room at Metropolitan Square, Damansara Perdana","selangor","Metropolitan Square, Damansara Perdana","RM 600.00","2019-07-26","25/07/2019","7","7418276"
"[ NEAR TO KTM/MRT SUNGAI BULOH ]: AFFORDABLE COMFY SINGLE ROOM WITH HIILY VIEW AT THE ZIZZ, CONDOMINIUM. RENTAL INDLUDED UTILITIES","selangor","Kota Damansara, Petaling Jaya","RM 600.00","2019-07-26","25/07/2019","7","7428442"
"Middle Room At SS14, Subang Jaya","selangor","SS14, Subang Jaya","RM 650.00","2019-07-26","25/07/2019","7","7424024"
"Single Small Room at Cova Suites, Kota Damansara, Near MRT, SEGI","selangor","Cova Suites, Kota Damansara","RM 600.00","2019-07-26","25/07/2019","7","7398419"
"Bandar Sunway Near Sunway Pyramid, KTM, including Aircond With WIFI","selangor","PJS 10, Bandar Sunway","RM 550.00","2019-07-26","25/07/2019","7","7348047"
"NEWLY FURNITURE!!! : NEAR KTM & KTM SUNGAI BULUH WITH PRIVATE TV @ THE ZIZZ , DAMANSARA DAMAI","selangor","Damansara Utama, Petaling Jaya","RM 600.00","2019-07-26","25/07/2019","7","7428870"
"Room For Rent At Putra Heights , Subang Jaya LRT & High Speed Wifi","selangor","Putra Heights, Subang Jaya","RM 650.00","2019-07-26","25/07/2019","7","7351890"
"Room Available For Rent At PJS 10 , Bandar Sunway with Free Wifi","selangor","PJS 10, Bandar Sunway","RM 600.00","2019-07-26","25/07/2019","7","7351885"
"Budget Room To Rent At USJ Subang Jaya & Free High Speed Wi-fi","selangor","UEP Subang Jaya, Subang Jaya","RM 530.00","2019-07-26","25/07/2019","7","7351894"
"Studio at Empire City, Damansara Perdana","selangor","Empire City, Damansara Perdana","RM 1100.00","2019-07-26","25/07/2019","7","7428986"
"Bilik di seksyen 2 bandar baru bangi/ukm/bangigetaaway","selangor","Bangi, Selangor","RM 320.00","2019-07-26","25/07/2019","7","7429722"
"Single Room at Perdana Emerald Near IKEA, ECURVE, THE EDGE, Nestle, Surian Tower (Astrazeneca, Procter & Gamble), 8mins to MRT","selangor","Perdana Emerald, Damansara Perdana","RM 780.00","2019-07-26","25/07/2019","7","7419743"
"Single Room Aircon at USJ2 near Summit, Da Men, Taipan, Subang Jaya, Selangor","selangor","Subang Jaya, Selangor","RM 400.00","2019-07-26","25/07/2019","7","7429684"
"Middle Room At Bandar Sunway, PJS 7 Walking to Taylor's Campus","selangor","Bandar Sunway, Petaling Jaya","RM 600.00","2019-07-26","25/07/2019","7","7426847"
"Room in Condo with affordable price, free WiFi and scheduled house keeping in Master Room at The Greens @ Subang West, Shah Alam","selangor","The Greens @ Subang West, Shah Alam","RM 350.00","2019-07-26","25/07/2019","7","7428482"
"Single Small Room at Cova Villa, Kota Damansara, Near MRT, SEGI University","selangor","Cova Villa, Kota Damansara","RM 600.00","2019-07-26","25/07/2019","7","7398417"
"SS2 Air con Room For Rent With Fully Facilitise & Wi-FI","selangor","SS2, Petaling Jaya","RM 590.00","2019-07-26","25/07/2019","7","7348483"
"Single Room at Ara Damansara, Petaling Jaya","selangor","Ara Damansara, Petaling Jaya","RM 700.00","2019-07-26","25/07/2019","7","7429599"
"Middle Room at Shah Alam, Selangor","selangor","Shah Alam, Selangor","RM 550.00","2019-07-26","25/07/2019","7","7429704"
"SS2, Petaling Jaya Middle Room Complete Facilities Include Wi-fi","selangor","SS2, Petaling Jaya","RM 650.00","2019-07-26","25/07/2019","7","7424439"
"Middle Room At SS2, Petaling Jaya Walking to LRT taman Bahagia","selangor","SS2, Petaling Jaya","RM 600.00","2019-07-26","25/07/2019","7","7426723"
"Bilik di seksyen 2 bandar baru bangi/ukm/bangigetaaway","selangor","Bangi, Selangor","RM 290.00","2019-07-26","25/07/2019","7","7429724"
"Middle Room at Kelana Jaya, Petaling Jaya","selangor","Kelana Jaya, Petaling Jaya","RM 500.00","2019-07-26","25/07/2019","7","7429726"
"SS2 PJ Fully Facilitise Available Room For Rent with High Speed Wi-FI","selangor","SS2, Petaling Jaya","RM 580.00","2019-07-26","25/07/2019","7","7351969"
"Single Room At SS14, Subang 10mins Walk to LRT SS18 With High Speed Wi-fi","selangor","SS14, Subang Jaya","RM 580.00","2019-07-26","25/07/2019","7","7423561"
"Fully Furnish Middle Room at The Edge Residence, UEP Subang Jaya, USJ1, USJ2, USJ5, USJ6, USJ11, SS14, SS15, SS18","selangor","The Edge Residence, UEP Subang Jaya","RM 600.00","2019-07-26","25/07/2019","7","7420087"
"SMALL Single room at COVA SUITE , SEGI UNIVERSITY , MRT","selangor","Kota Damansara, Petaling Jaya","RM 650.00","2019-07-26","25/07/2019","7","7399814"
"Middle Room at Section 17, Petaling Jaya","selangor","Section 17, Petaling Jaya","RM 380.00","2019-07-26","25/07/2019","7","7429728"
"New Renovation Available Room At SS 14 Subang Jaya NEARBY to LRT SS 18 With Wi-Fi","selangor","SS14, Subang Jaya","RM 580.00","2019-07-26","25/07/2019","7","7351881"
"MEDIUM ROOM FULLY FURNISHED OFFER !! HIGH WIFI SPEED !! 5 mins only to BRT SUNWAY LAGOON","selangor","PJS 9, Bandar Sunway","RM 650.00","2019-07-26","25/07/2019","7","7422534"
"Master Room at Ridzuan Condominium, Bandar Sunway","selangor","Ridzuan Condominium, Bandar Sunway","RM 710.00","2019-07-26","25/07/2019","7","7429719"
"USJ 1, Subang Jaya Middle Room Complete Facilities Include Wifi","selangor","USJ 1, UEP Subang Jaya","RM 600.00","2019-07-26","25/07/2019","7","7424424"
"PJS 10, Bandar Sunway Middle Room For Rent With Free WIFI","selangor","PJS 10, Bandar Sunway","RM 600.00","2019-07-26","25/07/2019","7","7420934"
"SS2 Available Room For Rent Section 17 & Section 19 Fully Facilitise & WIFI","selangor","SS2, Petaling Jaya","RM 580.00","2019-07-26","25/07/2019","7","7348072"
"Master Room at Kota Damansara, Petaling Jaya","selangor","Kota Damansara, Petaling Jaya","RM 400.00","2019-07-26","25/07/2019","7","7429381"
"Middle Room At Sea Park 10mins WALK to LRT taman Paramount With High Speedy Wifi","selangor","SS2, Petaling Jaya","RM 700.00","2019-07-26","25/07/2019","7","7423748"
"*Actual Photo* Nicest Medium Room with balcony | BK9, Puchong | 5 mins walk to LRT | Free Wifi","selangor","The Zest, Bandar Kinrara","RM 750.00","2019-07-26","25/07/2019","7","7419598"
"SPACIOUS Room at Emerald Perdana Near IKEA, E-CURVE, THE EDGE, Nestle, Surian Tower (Astrazeneca, Procter & Gamble), 8mins to MRT","selangor","Perdana Emerald, Damansara Perdana","RM 830.00","2019-07-26","25/07/2019","7","7382296"
"Single Small Room at Cova Suite Kota Damansara, Petaling Jaya Near MRT Station","selangor","Kota Damansara, Petaling Jaya","RM 600.00","2019-07-26","25/07/2019","7","7398422"
"Middle Room at SS2, Petaling Jaya Walking to Tropicana City MAll","selangor","SS2, Petaling Jaya","RM 600.00","2019-07-26","25/07/2019","7","7426724"
"Middle Room at Paramount View, Petaling Jaya","selangor","Paramount View, Petaling Jaya","RM 680.00","2019-07-26","25/07/2019","7","7429563"
"Middle Room at Kota Damansara, Petaling Jaya","selangor","Kota Damansara, Petaling Jaya","RM 550.00","2019-07-26","25/07/2019","7","7429691"
"Suite at Cyberjaya, Selangor","selangor","Cyberjaya, Selangor","RM 1400.00","2019-07-26","25/07/2019","7","7429642"
"MEDIUM ROOM LONG-TERM PROMO !!! UNIFI 100MBPS !! FIRST COME FIRST SERVE !!!","selangor","SS18, Subang Jaya","RM 570.00","2019-07-26","25/07/2019","7","7424035"
"Setia Alam Middle Room For Rent With Free WI-FI","selangor","Setia Alam, Shah Alam","RM 690.00","2019-07-26","25/07/2019","7","7420938"
"Middle Room at Petaling Jaya, Selangor","selangor","Petaling Jaya, Selangor","RM 500.00","2019-07-26","25/07/2019","7","7429608"
"USJ Subang Near , Near With LRT With Free High Speed Wifi","selangor","UEP Subang Jaya, Subang Jaya","RM 580.00","2019-07-26","25/07/2019","7","7348074"
"BIG Room at Emerald Perdana Near IKEA, E-CURVE, THE EDGE, Nestle, Surian Tower (Astrazeneca, Procter & Gamble), 8mins to MRT","selangor","Perdana Emerald, Damansara Perdana","RM 930.00","2019-07-26","25/07/2019","7","7382300"
"Subang JAYA SS 18 > 5Mins Walk to LRT Station ,Fully Facilities & free Wifi","selangor","Subang Jaya, Selangor","RM 580.00","2019-07-26","25/07/2019","7","7357307"
"You will love this Single Room at The Greens @ Subang West, Shah Alam","selangor","The Greens @ Subang West, Shah Alam","RM 400.00","2019-07-26","25/07/2019","7","7428601"
"Master Room at USJ 6, Can Move in By 10/8/2019","selangor","USJ 6, UEP Subang Jaya","RM 325.00","2019-07-26","25/07/2019","7","7429695"
"Full Facilitise & High Speed WIFI SS2 Aircon Double Room Available For Rent","selangor","SS2, Petaling Jaya","RM 630.00","2019-07-26","25/07/2019","7","7348013"
"Middle Room at Taman Cheras Permai, Batu 9 Cheras","selangor","Taman Cheras Permai, Batu 9 Cheras","RM 600.00","2019-07-26","25/07/2019","7","7397853"
"( Near BRT & KTM ) Medium Room at Bandar Sunway, Petaling Jaya","selangor","Bandar Sunway, Petaling Jaya","RM 700.00","2019-07-26","25/07/2019","7","7429686"
"Middle Room At Sea Park, Petaling Jaya Walking to LRT taman Paramount","selangor","Sea Park, Petaling Jaya","RM 700.00","2019-07-26","25/07/2019","7","7426725"
"Single Room at SS14, Subang Jaya Walking to LRT SS18","selangor","SS14, Subang Jaya","RM 500.00","2019-07-26","25/07/2019","7","7426726"
"SS14 , Subang Jaya Middle Room Complete Facilities Include Wifi","selangor","SS14, Subang Jaya","RM 600.00","2019-07-26","25/07/2019","7","7424481"
"Middle Room at Cova Villa, Kota Damansara, Near SEGI, MRT","selangor","Cova Villa, Kota Damansara","RM 650.00","2019-07-26","25/07/2019","7","7398423"
"Middle Room at Pelangi Utama, Bandar Utama","selangor","Pelangi Utama, Bandar Utama","RM 700.00","2019-07-26","25/07/2019","7","7429710"
"Single Room at Metropolitan Square, Damansara Perdana","selangor","Metropolitan Square, Damansara Perdana","RM 550.00","2019-07-26","25/07/2019","7","7419851"
"Affordable Cozy Single Room The Zest | Puchong | Bandar Kinrara | 5 mins walk to LRT","selangor","The Zest, Bandar Kinrara","RM 590.00","2019-07-26","25/07/2019","7","7387064"
"MEDIUM ROOM FULLY FURNISHED OFFER !! HIGH WIFI SPEED","selangor","SS2, Petaling Jaya","RM 580.00","2019-07-26","25/07/2019","7","7424008"
"EXCLUSIVE ROOM!!!! : [THE ZIZZ CONDOMINIUM] : NEAR KTM & KTM SUNGAI BULUH WITH PRIVATE TV !!","selangor","Damansara Utama, Petaling Jaya","RM 600.00","2019-07-26","25/07/2019","7","7428851"
"Single Room at Suria Jaya e-SOFO, Shah Alam","selangor","Suria Jaya e-SOFO, Shah Alam","RM 420.00","2019-07-26","25/07/2019","7","7429707"
"Master Room Near Paramount LRT, Petaling Jaya","selangor","Section 14, Petaling Jaya","RM 850.00","2019-07-26","25/07/2019","7","7429582"
"Fully Furnish Master Room at The Edge Residence, UEP Subang Jaya, USJ1, USJ2, USJ5, USJ6, USJ11, SS14, SS15","selangor","The Edge Residence, UEP Subang Jaya","RM 750.00","2019-07-26","25/07/2019","7","7420093"
"Middle Room with own bathroom at SS15, Subang Jaya","selangor","SS15, Subang Jaya","RM 500.00","2019-07-26","25/07/2019","7","7429700"
"Fully Furnished Middle Room at Garden Park, Bandar Sungai Long","selangor","Garden Park, Bandar Sungai Long","RM 400.00","2019-07-26","25/07/2019","7","7429498"
"Single Room at Shah Alam, Selangor","selangor","Shah Alam, Selangor","RM 600.00","2019-07-26","25/07/2019","7","7429527"
"Puchong New Fully Furnished Medium Room, 1 Min to LRT Station","selangor","Bandar Puchong Jaya, Puchong","RM 800.00","2019-07-26","25/07/2019","7","7429595"
"Single Room at Cyberjaya, Selangor","selangor","Cyberjaya, Selangor","RM 500.00","2019-07-26","25/07/2019","7","7429647"
"Single Room at Cyberjaya, Selangor","selangor","Cyberjaya, Selangor","RM 380.00","2019-07-26","25/07/2019","7","7353608"
"Mutiara Perdana @ TAYLORs LAKESIDE CAMPUS BANDAR SUNWAY","selangor","Bandar Sunway, Petaling Jaya","RM 600.00","2019-07-26","25/07/2019","7","7429698"
"[Hot] (LAST 2 UNITS) Newly Renovated Fully Furnished Single Rooms @ PJS 7 / Bandar Sunway","selangor","PJS 7, Bandar Sunway","RM 620.00","2019-07-26","25/07/2019","7","7429714"
"Beautiful Single Room at Avenue Crest, Shah Alam","selangor","Avenue Crest, Shah Alam","RM 450.00","2019-07-26","25/07/2019","7","7429499"
"Cozy room in Middle Room at Cova Suites","selangor","Cova Suites, Kota Damansara","RM 900.00","2019-07-26","25/07/2019","7","7426076"
"Single Room at SS18 , SUbang 5mins WALK to LRT With High Speed Wifi","selangor","SS18, Subang Jaya","RM 550.00","2019-07-26","25/07/2019","7","7423091"
"Furnished Include Utility, Internet & Cleaning - SS2 Master Room","selangor","SS2, Petaling Jaya","RM 800.00","2019-07-26","25/07/2019","7","7429667"
"Single Room at D'Sara Sentral, Sungai Buloh","selangor","D'Sara Sentral, Sungai Buloh","RM 650.00","2019-07-26","25/07/2019","7","7429644"
"Furnished Private Aircon Room at SS2, PJ - Available in Sept","selangor","SS2, Petaling Jaya","RM 450.00","2019-07-26","25/07/2019","7","7412102"
"[Master] Cyberia Smarthomes Furnished clean ac room near MMU Dpulze IBM","selangor","Cyberjaya, Selangor","RM 650.00","2019-07-26","25/07/2019","7","7194272"
"Include Utility, Internet & Cleaning - SS2 Middle Room","selangor","SS2, Petaling Jaya","RM 550.00","2019-07-26","25/07/2019","7","7429669"
"Non-smoking Unit at SS15 , Subang Jaya 5mins Walking INTI College, Subang Square With Wifi , Cleaning Service","selangor","SS15, Subang Jaya","RM 550.00","2019-07-26","25/07/2019","7","7424209"
"Master Room at Subang Jaya, Selangor","selangor","Subang Jaya, Selangor","RM 550.00","2019-07-26","25/07/2019","7","7429674"
"Middle Room At Setia Alam Nearby Setia City Mall , Klang Sentral , Bukit Raja With High Speedy Wifi","selangor","Setia Alam, Shah Alam","RM 550.00","2019-07-26","25/07/2019","7","7423757"
"[INSTAGRAMMABLE & LIVABLE!] In great need of a rejuvenating & relaxing room to chill in after work? BU1, Bandar Utama, Petaling Jaya","selangor","Bandar Utama, Petaling Jaya","RM 880.00","2019-07-26","25/07/2019","7","7429706"
"Middle Room At SS15, SUbang 5mins WALK to INTI College, Subang Square With High Speed Wifi","selangor","SS15, Subang Jaya","RM 550.00","2019-07-26","25/07/2019","7","7423751"
"Single Room at Subang Jaya, Selangor","selangor","Subang Jaya, Selangor","RM 500.00","2019-07-26","25/07/2019","7","7429567"
"Room For Rent","selangor","Bandar Sunway, Petaling Jaya","RM 650.00","2019-07-26","25/07/2019","7","7196939"
"Non-smoking Unit at USJ 18 , Subang Jaya 8mins Walking 19 USJ City MAll , LRT USJ 21 With Cleaning Service","selangor","USJ 18, UEP Subang Jaya","RM 590.00","2019-07-26","25/07/2019","7","7423897"
"Single Room at Bandar Mahkota Cheras, Cheras South","selangor","Bandar Mahkota Cheras, Cheras South","RM 350.00","2019-07-26","25/07/2019","7","7429553"
"Non-smoking Unit at SS2, Petaling Jaya With Wi-fi, Cleaning Service","selangor","SS2, Petaling Jaya","RM 600.00","2019-07-26","25/07/2019","7","7423889"
"Middle Room at Pelangi Utama, Bandar Utama","selangor","Pelangi Utama, Bandar Utama","RM 700.00","2019-07-26","25/07/2019","7","7429532"
"Luxury Fully Furnish Middle Room at The Edge Residence, UEP Subang Jaya, USJ1, USJ2, USJ5, USJ6, USJ11, SS14, SS15, SS18 Bandar Sunway","selangor","The Edge Residence, UEP Subang Jaya","RM 750.00","2019-07-26","25/07/2019","7","7420085"
"Unit PEREMPUAN TERHAD ~BARU~ @ Mentari Court berdekatan Sunway Pyramid & The One Academy","selangor","Bandar Sunway, Petaling Jaya","RM 300.00","2019-07-26","25/07/2019","7","7429696"
"Single Room at Cyberjaya, Selangor","selangor","Cyberjaya, Selangor","RM 500.00","2019-07-26","25/07/2019","7","7429649"
"Middle Room at One South, Seri Kembangan","selangor","One South, Seri Kembangan","RM 600.00","2019-07-26","25/07/2019","7","7383317"
"Single Room at Taman Subang Intan, Subang, Shah Alam","selangor","Taman Subang Intan, Subang","RM 400.00","2019-07-26","25/07/2019","7","7429687"
"Male Room Ala-Hotel UPM UNITEN","selangor","Bandar Putra Permai, Seri Kembangan","RM 330.00","2019-07-26","25/07/2019","7","7353598"
"Single Room at Subang Avenue, Subang Jaya LRT","selangor","Subang Avenue, Subang Jaya","RM 750.00","2019-07-26","25/07/2019","7","7429564"
"Master Room at Pandan Indah, Pandan","selangor","Pandan Indah, Pandan","RM 450.00","2019-07-26","25/07/2019","7","7429640"
"Private Bathroom with water heater,Free WiFi in Master Room at Damansara Damai, Petaling Jaya","selangor","Damansara Damai, Petaling Jaya","RM 850.00","2019-07-26","25/07/2019","7","7429224"
"Master Room at Subang Jaya, Selangor","selangor","Subang Jaya, Selangor","RM 550.00","2019-07-26","25/07/2019","7","7429677"
"Middle Room at Metropolitan Square, Damansara Perdana","selangor","Metropolitan Square, Damansara Perdana","RM 800.00","2019-07-26","25/07/2019","7","7395454"
"Middle Room at lagoon perdana apartment","selangor","Bandar Sunway, Petaling Jaya","RM 250.00","2019-07-26","25/07/2019","7","7429575"
"Newly Renovated PJS7 Terrace House Fastest Internet 100mbps","selangor","Bandar Sunway, Petaling Jaya","RM 600.00","2019-07-26","25/07/2019","7","7429601"
"Quiet,Brand New and Privacy Middle Room at The Greens @ Subang West, Shah Alam","selangor","The Greens @ Subang West, Shah Alam","RM 600.00","2019-07-26","25/07/2019","7","7428612"
"Master Room at Metropolitan Square, Damansara Perdana","selangor","Metropolitan Square, Damansara Perdana","RM 800.00","2019-07-26","25/07/2019","7","7422504"
"Master Room at Shah Alam, Selangor","selangor","Shah Alam, Selangor","RM 550.00","2019-07-26","25/07/2019","7","7429470"
"Middle Room at Kelana Jaya, Petaling Jaya","selangor","Kelana Jaya, Petaling Jaya","RM 780.00","2019-07-26","25/07/2019","7","7429600"
"Furnished Master Room, attached bath, divan bed, free wifi, Subang Avenue, Subang Jaya LRT","selangor","Subang Avenue, Subang Jaya","RM 1100.00","2019-07-26","25/07/2019","7","7429569"
"Master Room for Double at BU11, Bandar Utama","selangor","BU12, Bandar Utama","RM 800.00","2019-07-26","25/07/2019","7","7389867"
"BU12 Medium Room FULL FURNISHED Available on 1st July 2019!","selangor","Bandar Utama, Petaling Jaya","RM 480.00","2019-07-26","25/07/2019","7","7408960"
"Privacy , FREE WIFI and private bathroom at One Damansara Condominium Damansara Damai","selangor","One Damansara, Damansara Damai","RM 850.00","2019-07-26","25/07/2019","7","7428451"
"Single Room at Section 11, Petaling Jaya","selangor","Section 11, Petaling Jaya","RM 600.00","2019-07-26","25/07/2019","7","7429548"
"Single Room at Bandar Sunway, Petaling Jaya","selangor","Bandar Sunway, Petaling Jaya","RM 550.00","2019-07-26","25/07/2019","7","7429693"
"BEAUTIFUL FULLY FURNISHED Middle Room WITH NICE VIEW at Damansara Damai, Petaling Jaya","selangor","Damansara Damai, Petaling Jaya","RM 700.00","2019-07-26","25/07/2019","7","7429237"
"Kayangan Apartment Room For Rent @ PJS 10/24","selangor","Bandar Sunway, Petaling Jaya","RM 400.00","2019-07-26","25/07/2019","7","7429634"
"Middle Room at PJS 9, Bandar Sunway","selangor","PJS 9, Bandar Sunway","RM 550.00","2019-07-26","25/07/2019","7","7429590"
"Middle Room at UEP Subang Jaya, Subang Jaya","selangor","UEP Subang Jaya, Subang Jaya","RM 753.00","2019-07-26","25/07/2019","7","7429522"
"Master Room at USJ 6, UEP Subang Jaya","selangor","USJ 6, UEP Subang Jaya","RM 325.00","2019-07-26","25/07/2019","7","7424028"
"Middle Room at USJ Court 5, Subang Jaya, 3min walk to Taipan LRT Station!","selangor","Goodyear Court 5, UEP Subang Jaya","RM 420.00","2019-07-26","25/07/2019","7","7429573"
"Single Room at Subang Jaya, Selangor","selangor","Subang Jaya, Selangor","RM 550.00","2019-07-26","25/07/2019","7","7429578"
"Middle Room at PJS 7, Bandar Sunway","selangor","PJS 7, Bandar Sunway","RM 600.00","2019-07-26","25/07/2019","7","7429614"
"Private Small Room at Casa Residenza, Kota Damansara Near SEGI","selangor","Casa Residenza, Kota Damansara","RM 530.00","2019-07-26","25/07/2019","7","7398390"
"Middle Room at Taman Subang Intan, Subang, Shah Alam","selangor","Taman Subang Intan, Subang","RM 550.00","2019-07-26","25/07/2019","7","7429683"
"Middle Room at Cyberjaya, Selangor","selangor","Cyberjaya, Selangor","RM 625.00","2019-07-26","25/07/2019","7","7429646"
"Studio at Cyberjaya, Selangor","selangor","Cyberjaya, Selangor","RM 1200.00","2019-07-26","25/07/2019","7","7429639"
"Single Room at DK Senza, Bandar Sunway","selangor","DK Senza, Bandar Sunway","RM 800.00","2019-07-26","25/07/2019","7","7427670"
"Beautiful Single Room at Impian Meridian, UEP Subang Jaya","selangor","Impian Meridian, UEP Subang Jaya","RM 650.00","2019-07-26","25/07/2019","7","7429500"
"Fully Furnish Middle Room at The Edge Residence, UEP Subang Jaya, USJ1, USJ2, USJ5, USJ6, USJ11, SS14, SS15, SS18 Bandar Sunway","selangor","The Edge Residence, UEP Subang Jaya","RM 600.00","2019-07-26","25/07/2019","7","7420074"
