"Studio at Ampang, Selangor","selangor","Ampang, Selangor","RM 1000.00","2019-08-09","08/08/2019","7","7434302"
"[Balcony Room] Affordable middle room with free shuttle bus PJ06 until One Utama Area at One Damansara, Damansara Damai","selangor","One Damansara, Damansara Damai","RM 700.00","2019-08-09","08/08/2019","7","7426396"
"Middle Room at SS4, Kelana Jaya Nearby Paradigm MAll","selangor","SS4, Kelana Jaya","RM 530.00","2019-08-09","08/08/2019","7","7425319"
"Single Room at Kota Damansara, Petaling Jaya","selangor","Kota Damansara, Petaling Jaya","RM 400.00","2019-08-09","08/08/2019","7","7435256"
"Master Room at Batu 9 Cheras, Cheras South","selangor","Green Terrain, Cheras South","RM 850.00","2019-08-09","08/08/2019","7","7435079"
"SS15 opp Subang Avenue - fully furnished air cond room","selangor","Subang Jaya, Selangor","RM 530.00","2019-08-09","08/08/2019","7","7414608"
"Bandar Botanic Klang Middle Room","selangor","Klang, Selangor","RM 500.00","2019-08-09","08/08/2019","7","7435242"
"Single Room At SS2, Petaling Jaya Walking LRT Taman Bahagia","selangor","SS2, Petaling Jaya","RM 550.00","2019-08-09","08/08/2019","7","7422431"
"Middle Room Rent At Bandar Puchong Jaya, Puchong","selangor","Bandar Puchong Jaya, Puchong","RM 650.00","2019-08-09","08/08/2019","7","7383691"
"Master Room at Mentari Court 1, Bandar Sunway","selangor","Mentari Court 1, Bandar Sunway","RM 600.00","2019-08-09","08/08/2019","7","7435117"
"Single Room at Taman Bukit Serdang, Seri Kembangan","selangor","Taman Bukit Serdang, Seri Kembangan","RM 200.00","2019-08-09","08/08/2019","7","7435270"
"Full Furnished Room At Kota Damansara , Dataran Sunway, the Strand & WIFI","selangor","Kota Damansara, Petaling Jaya","RM 700.00","2019-08-09","08/08/2019","7","7353861"
"Middle Room at Subang Jaya, Selangor","selangor","Subang Jaya, Selangor","RM 600.00","2019-08-09","08/08/2019","7","7435262"
"Available Middle Room At Sea Park 10mins WALK to LRT taman Paramount With High Speedy Wifi","selangor","Sea Park, Petaling Jaya","RM 700.00","2019-08-09","08/08/2019","7","7423780"
"Middle Room at Cova Villa, Kota Damansara","selangor","Cova Villa, Kota Damansara","RM 700.00","2019-08-09","08/08/2019","7","7435225"
"Single Room at Cyber Heights Villa, Cyberjaya","selangor","Cyber Heights Villa, Cyberjaya","RM 499.00","2019-08-09","08/08/2019","7","7350519"
"Full Facilities Room Rent ,Near Sunway Pyramid , Sunway Medical Centre with WIFI","selangor","PJS 7, Bandar Sunway","RM 550.00","2019-08-09","08/08/2019","7","7396623"
"Single Room at Shah Alam, Selangor","selangor","The Greens @ Subang West, Shah Alam","RM 500.00","2019-08-09","08/08/2019","7","7435177"
"Studio at Hyve, Cyberjaya","selangor","Hyve, Cyberjaya","RM 1400.00","2019-08-09","08/08/2019","7","7434162"
"Fully furnished room, Indah Villa, Near Sunway University, Pyramid","selangor","Indah Villa, Bandar Sunway","RM 850.00","2019-08-09","08/08/2019","7","7433152"
"Master Room, Lily&Rose Apartment, Kelana Jaya, Damansara","selangor","Kelana Jaya, Petaling Jaya","RM 700.00","2019-08-09","08/08/2019","7","6969282"
"FF Small Room at Cyberjaya, Selangor","selangor","Cyberjaya, Selangor","RM 450.00","2019-08-09","08/08/2019","7","7435306"
"Master Room at Elevia Residences, Bandar Puchong Utama","selangor","Elevia Residences, Bandar Puchong Utama","RM 750.00","2019-08-09","08/08/2019","7","7435243"
"Single Room at The Regina, UEP Subang Jaya","selangor","The Regina, UEP Subang Jaya","RM 450.00","2019-08-09","08/08/2019","7","7435150"
"Single Room at PJS 9, Bandar Sunway","selangor","PJS 9, Bandar Sunway","RM 500.00","2019-08-09","08/08/2019","7","7435081"
"PJS Bandar Sunway Room Rent , With Aircon & Weekly cleaning","selangor","Bandar Sunway, Petaling Jaya","RM 590.00","2019-08-09","08/08/2019","7","7346205"
"Town House Middle Room at Taman Sungai Besi Indah, Seri Kembangan","selangor","Taman Sungai Besi Indah, Seri Kembangan","RM 400.00","2019-08-09","08/08/2019","7","7433485"
"Studio at Axis SoHu, Pandan","selangor","Axis SoHu, Pandan","RM 1400.00","2019-08-09","08/08/2019","7","7435216"
"Single Room at SS2 , Petaling Jaya With Cleaning Service, FREE WI-FI","selangor","SS2, Petaling Jaya","RM 550.00","2019-08-09","08/08/2019","7","7420737"
"Master Room at Pacific Place, Ara Damansara","selangor","Pacific Place, Ara Damansara","RM 1080.00","2019-08-09","08/08/2019","7","7435275"
"Middle Room at Pandan Perdana, Pandan","selangor","Pandan Perdana, Pandan","RM 450.00","2019-08-09","07/08/2019","7","7408221"
"Middle Room at Klang, Selangor","selangor","Klang, Selangor","RM 500.00","2019-08-09","07/08/2019","7","7404868"
"Middle Room at Pacific Place, Ara Damansara","selangor","Pacific Place, Ara Damansara","RM 750.00","2019-08-09","07/08/2019","7","7435142"
"Single Room at Pacific Place, Ara Damansara","selangor","Pacific Place, Ara Damansara","RM 600.00","2019-08-09","07/08/2019","7","7435137"
"USJ 3/1E Middle Room at Subang Jaya, Selangor","selangor","Subang Jaya, Selangor","RM 600.00","2019-08-09","07/08/2019","7","7435124"
"Master Room at UEP Subang Jaya, Subang Jaya","selangor","UEP Subang Jaya, Subang Jaya","RM 1000.00","2019-08-09","07/08/2019","7","7434993"
"FREE WIFI l SUPER NICE Middle Room l Cova Villa l Kota Damansara","selangor","Cova Villa, Kota Damansara","RM 680.00","2019-08-09","07/08/2019","7","7434196"
"Middle Room at Ampang, Selangor","selangor","Ampang, Selangor","RM 500.00","2019-08-09","07/08/2019","7","7435095"
"Master Room at Bandar Utama, Petaling Jaya","selangor","Bandar Utama, Petaling Jaya","RM 900.00","2019-08-09","07/08/2019","7","7435125"
"Free Weekly Cleaning At Klang , Bandar Botanik","selangor","Klang, Selangor","RM 650.00","2019-08-09","07/08/2019","7","7422523"
"Single Room at PJS 9, Bandar Sunway","selangor","PJS 9, Bandar Sunway","RM 500.00","2019-08-09","07/08/2019","7","7434995"
"Middle Room at Dwiputra Residences, Putrajaya","selangor","Dwiputra Residences, Putrajaya","RM 360.00","2019-08-09","07/08/2019","7","7435018"
"Single Room at Avenue Crest, Shah Alam","selangor","Avenue Crest, Shah Alam","RM 370.00","2019-08-09","07/08/2019","7","7435088"
"Single Room at SS2, Included Utility Fees, Wifi & Cleaning","selangor","SS2, Petaling Jaya","RM 450.00","2019-08-09","07/08/2019","7","7435030"
"Available Room Rent At Kota Damansara Section 5 Seri Utama (WIFI)","selangor","Kota Damansara, Petaling Jaya","RM 550.00","2019-08-09","07/08/2019","7","7348471"
"Master bedroom c/w own use toilet and air cond bill $690 @ jalan pjs7/7j","selangor","Bandar Sunway, Petaling Jaya","RM 690.00","2019-08-09","07/08/2019","7","7434986"
"Single Room at Kota Damansara, Petaling Jaya","selangor","Kota Damansara, Petaling Jaya","RM 450.00","2019-08-09","07/08/2019","7","7435029"
"Beautiful Room at Impian Meridian, Brt South Quay","selangor","Impian Meridian, UEP Subang Jaya","RM 1200.00","2019-08-09","07/08/2019","7","7434966"
"[50% OFFER!!!] : Near to MRT/KTM Sungai Buloh, A Premium Single Room With A Private TV In Each Room Only@ The Zizz,Damansara Damai,Petaling Jaya","selangor","Petaling Jaya, Selangor","RM 600.00","2019-08-09","07/08/2019","7","7428681"
"Single Room at SS14, Subang 10mins Walk to LRT SS18 With High Speed Wifi","selangor","SS14, Subang Jaya","RM 580.00","2019-08-09","07/08/2019","7","7423561"
"Single Room at Section 17, Petaling Jaya","selangor","Section 17, Petaling Jaya","RM 350.00","2019-08-09","07/08/2019","7","7435119"
"Middle Room at Impian Meridian, UEP Subang Jaya","selangor","Impian Meridian, UEP Subang Jaya","RM 650.00","2019-08-09","07/08/2019","7","7435122"
"COZY & BEAUTIFUL l FREE WIFI l Master Room l The Zest l Bandar Kinrara l Puchong","selangor","The Zest, Bandar Kinrara","RM 880.00","2019-08-09","07/08/2019","7","7434210"
"Include Utility, Internet & Cleaning - SS2 Middle Room","selangor","SS2, Petaling Jaya","RM 600.00","2019-08-09","07/08/2019","7","7435090"
"Single Room at PJS 9, Bandar Sunway","selangor","PJS 9, Bandar Sunway","RM 450.00","2019-08-09","07/08/2019","7","7408006"
"Single Room at Suria Jaya e-SOFO, Shah Alam","selangor","Suria Jaya e-SOFO, Shah Alam","RM 380.00","2019-08-09","07/08/2019","7","7434910"
"Single Room at Metropolitan Square, Damansara Perdana","selangor","Metropolitan Square, Damansara Perdana","RM 650.00","2019-08-09","07/08/2019","7","7395536"
"Rarely Available Stylish Room to rent","selangor","Cova Suites, Kota Damansara","RM 900.00","2019-08-09","07/08/2019","7","7430722"
"USJ2 - fully furnished single room in quiet surroundings opp park","selangor","UEP Subang Jaya, Subang Jaya","RM 530.00","2019-08-09","07/08/2019","7","7427326"
"Middle Room at Ampang, Selangor","selangor","Ampang, Selangor","RM 450.00","2019-08-09","07/08/2019","7","7434675"
"Master Room at Shah Alam, Selangor","selangor","Shah Alam, Selangor","RM 285.00","2019-08-09","07/08/2019","7","7434827"
"Brand new Single Room for rent at Taman Subang Mas, Shah Alam","selangor","Taman Subang Mas, Shah Alam","RM 550.00","2019-08-09","07/08/2019","7","7435015"
"Middle Room at Taman Putra Prima, Puchong","selangor","Taman Putra Prima, Puchong","RM 550.00","2019-08-09","07/08/2019","7","7412977"
"Middle Room at The Zizz, Damansara Damai","selangor","The Zizz, Damansara Damai","RM 700.00","2019-08-09","07/08/2019","7","7435004"
"SS15 opp Subang Parade - fully furnished master room","selangor","Subang Jaya, Selangor","RM 590.00","2019-08-09","07/08/2019","7","7420890"
"Free WIFI & Weekly Cleaning at Bandar Puteri Puchong, Puchong","selangor","Bandar Puteri Puchong, Puchong","RM 600.00","2019-08-09","07/08/2019","7","7432529"
"Middle Room at SS14, Subang Jaya","selangor","SS14, Subang Jaya","RM 650.00","2019-08-09","07/08/2019","7","7424024"
"Room At Taman Jaya PJ52, Saito University & WIFI & Full Furnish","selangor","Petaling Jaya, Selangor","RM 550.00","2019-08-09","07/08/2019","7","7350906"
"Single Room at PJS 7, Bandar Sunway","selangor","PJS 7, Bandar Sunway","RM 650.00","2019-08-09","07/08/2019","7","7435086"
"SS15 opp Subang Parade - fully furnished air cond room","selangor","Subang Jaya, Selangor","RM 530.00","2019-08-09","07/08/2019","7","7413596"
"Room At Subang, SS18 Walking Distance LRT With High Speed Wifi","selangor","SS18, Subang Jaya","RM 580.00","2019-08-09","07/08/2019","7","7355957"
"WI-FI & Weekly Cleaning At SS15, Subang Jaya","selangor","SS15, Subang Jaya","RM 600.00","2019-08-09","07/08/2019","7","7422525"
"HOUSEMATE WANTED. RUMAH CANTIK. SEGERAAA!!","selangor","Putrajaya, Selangor","RM 500.00","2019-08-09","07/08/2019","7","7377598"
"Room @ Tmn Muhibbah (3 min walking to Serdang KTM)/immediate","selangor","Seri Kembangan, Selangor","RM 400.00","2019-08-09","07/08/2019","7","7431364"
"USJ2 - single room with private bath in quiet surroundings opp park","selangor","UEP Subang Jaya, Subang Jaya","RM 520.00","2019-08-09","07/08/2019","7","7414604"
"Available Middle Room Rent At SS14 , Subang Jaya NEAR LRT SS18, Free High Speed WiFi","selangor","SS14, Subang Jaya","RM 550.00","2019-08-09","07/08/2019","7","7393110"
"Middle Room rENT SS3 Petaling Jaya, Walking distance to LRT Taman Paramount [WIFI]","selangor","SS3, Petaling Jaya","RM 560.00","2019-08-09","07/08/2019","7","7398705"
"Single Room at Setia Alam, Shah Alam","selangor","Setia Alam, Shah Alam","RM 440.00","2019-08-09","07/08/2019","7","7435074"
"Middle Room at Cova Suites, Kota Damansara","selangor","Cova Suites, Kota Damansara","RM 850.00","2019-08-09","07/08/2019","7","7435069"
"Aircond room with toilet (fully furnished) -- 350m to Taman Bahagia LRT SS2","selangor","SS2, Petaling Jaya","RM 750.00","2019-08-09","07/08/2019","7","7435065"
"Free WI-FI & Weekly Cleaning at Taman Wawasan, Pusat Bandar Puchong","selangor","Taman Wawasan, Pusat Bandar Puchong","RM 590.00","2019-08-09","07/08/2019","7","7432516"
"Single Room at SS14, Subang Jaya Walking to LRT SS18","selangor","SS14, Subang Jaya","RM 500.00","2019-08-09","07/08/2019","7","7426726"
"Bandar Sunway PJS 10 Room Rent With aircon & weekly Housekeeping","selangor","PJS 10, Bandar Sunway","RM 540.00","2019-08-09","07/08/2019","7","7381665"
"Single Room at The Zizz, Damansara Damai","selangor","The Zizz, Damansara Damai","RM 450.00","2019-08-09","07/08/2019","7","7434981"
"Affordable Living at USJ 18, UEP Subang Jaya With Free High Speed WIFI","selangor","USJ 18, UEP Subang Jaya","RM 520.00","2019-08-09","07/08/2019","7","7412314"
"Private room nearby Taman Bahagia lrt station(girl only)","selangor","SS2, Petaling Jaya","RM 750.00","2019-08-09","07/08/2019","7","7432657"
"Middle Room at Cova Suites, Kota Damansara","selangor","Cova Suites, Kota Damansara","RM 850.00","2019-08-09","07/08/2019","7","7435052"
"Middle Room Rent at Puchong Utama & Stretagy Location & Fully Facilities & Free High Speed Wifi","selangor","Puchong, Selangor","RM 580.00","2019-08-09","07/08/2019","7","7383727"
"Single Room at PJS 9, Bandar Sunway","selangor","PJS 9, Bandar Sunway","RM 550.00","2019-08-09","07/08/2019","7","7435035"
"Master Room at i-Soho, Shah Alam","selangor","i-Soho, Shah Alam","RM 238.00","2019-08-09","07/08/2019","7","7435072"
"Middle Room at The Regina, UEP Subang Jaya","selangor","The Regina, UEP Subang Jaya","RM 600.00","2019-08-09","07/08/2019","7","7434173"
"[Large Dining Area] Premium Single Room with 10 minutes distance to Mrt Sg Buluh at one Damansara Condominium at One Damansara, Damansara Damai","selangor","One Damansara, Damansara Damai","RM 600.00","2019-08-09","07/08/2019","7","7426405"
"Master Room at Putra Heights, Subang Jaya","selangor","Putra Heights, Subang Jaya","RM 850.00","2019-08-09","07/08/2019","7","7434964"
"Middle Room at PJS 9, Bandar Sunway","selangor","PJS 9, Bandar Sunway","RM 600.00","2019-08-09","07/08/2019","7","7434699"
"Middle Room at SS2, Petaling Jaya","selangor","SS2, Petaling Jaya","RM 800.00","2019-08-09","07/08/2019","7","7434899"
"Master Room at Ara Damansara, Petaling Jaya","selangor","Ara Damansara, Petaling Jaya","RM 450.00","2019-08-09","07/08/2019","7","7435002"
"Middle Room For Rent Near Sunway Pyramid With High Speed WIFI","selangor","Bandar Sunway, Petaling Jaya","RM 570.00","2019-08-09","07/08/2019","7","7352007"
"Middle Room At Section 17 Walking distance Jaya ONE, International Islamic UNI [High Speed WIFI]","selangor","Section 17, Petaling Jaya","RM 650.00","2019-08-09","07/08/2019","7","7401299"
"PEREMPUAN, Middle Room at Section 14, Petaling Jaya","selangor","Section 14, Petaling Jaya","RM 280.00","2019-08-09","07/08/2019","7","7434839"
"Single Room at USJ 20, Subang Jaya With Cleaning Service, WI-FI","selangor","USJ 20, UEP Subang Jaya","RM 550.00","2019-08-09","07/08/2019","7","7421033"
"Ss2 Available Room For Rent Near Mcdonalds , TOWN & free High Speed WIFI","selangor","SS2, Petaling Jaya","RM 600.00","2019-08-09","07/08/2019","7","7377208"
"High Speed Wifi Include Utility, Internet & Cleaning - SS2 Single Room","selangor","SS2, Petaling Jaya","RM 450.00","2019-08-09","07/08/2019","7","7434768"
"Single Small Room at Pacific Place Ara Damansara Petaling Jaya, Selangor Near To LRT","selangor","Petaling Jaya, Selangor","RM 600.00","2019-08-09","07/08/2019","7","7398854"
"Single Premium Room at Subang Jaya, USJ, Air-Cond, WIFI, LRT, Boutique Hostel","selangor","PJS 10, Bandar Sunway","RM 395.00","2019-08-09","07/08/2019","7","7403604"
"Middle Room at UEP Subang Jaya, Subang Jaya","selangor","UEP Subang Jaya, Subang Jaya","RM 750.00","2019-08-09","07/08/2019","7","7434999"
"Strategic Location! Damansara Jaya @ SS22 [KDU College . Atria . Tropicana Mall]","selangor","Damansara Jaya, Petaling Jaya","RM 600.00","2019-08-09","07/08/2019","7","7408069"
"Middle Room at Putra Heights, Subang Jaya","selangor","Putra Heights, Subang Jaya","RM 700.00","2019-08-09","07/08/2019","7","7435016"
"Single Room at Jasmine Towers, Petaling Jaya","selangor","Jasmine Towers, Petaling Jaya","RM 700.00","2019-08-09","07/08/2019","7","7435045"
"(ONE MONTH DEPOSIT) Single Room at BU11, Bandar Utama","selangor","BU11, Bandar Utama","RM 550.00","2019-08-09","07/08/2019","7","7385582"
"Middle Room at 16 Sierra , Puchong With Weekly Cleaning","selangor","16 Sierra, Puchong","RM 540.00","2019-08-09","07/08/2019","7","7397664"
"[Special Offer!!] Fully furnished room for rent in Shah Alam","selangor","Shah Alam, Selangor","RM 450.00","2019-08-09","07/08/2019","7","7434603"
"SS2 Room For Rent Near Starbuck & full facilitise & Free Wifi","selangor","SS2, Petaling Jaya","RM 590.00","2019-08-09","07/08/2019","7","7361003"
"Single Room at Bandar Sunway, Petaling Jaya","selangor","Bandar Sunway, Petaling Jaya","RM 750.00","2019-08-09","07/08/2019","7","7434234"
"Non-smoking Unit At Putra Heights, Subang Jaya With FREE Wifi, Cleaning Service","selangor","Putra Heights, Subang Jaya","RM 550.00","2019-08-09","07/08/2019","7","7424405"
"Room at The Greens @ Subang West, Shah Alam","selangor","The Greens @ Subang West, Shah Alam","RM 650.00","2019-08-09","07/08/2019","7","7413355"
"Room Attach bathroom with Aircon at D'Kayangan Section 13,Shah Alam [WIFI]","selangor","D'Kayangan, Shah Alam","RM 700.00","2019-08-09","07/08/2019","7","7343979"
"Room For Rent at Bandar Bukit Puchong, Near Aeon Puchong Utama","selangor","Bandar Bukit Puchong, Puchong","RM 550.00","2019-08-09","07/08/2019","7","7392441"
"50% OFFER : Full Furnished with FREE High Speed WiFi @ The Zizz ,Damansara Damai, Petaling Jaya","selangor","Damansara Damai, Petaling Jaya","RM 600.00","2019-08-09","07/08/2019","7","7428671"
"Setia Alam Near Setia City Mall, Bandar Bukit Raja , Include Utilities With Weekly Cleaning","selangor","Setia Alam, Shah Alam","RM 550.00","2019-08-09","07/08/2019","7","7349476"
"Puchong Jaya Available Room Rent, Walking to LRT Station > 3min, with WiFi & Full Facilities","selangor","Puchong, Selangor","RM 550.00","2019-08-09","07/08/2019","7","7353303"
"Single Room at Hyve, Cyberjaya","selangor","Hyve, Cyberjaya","RM 500.00","2019-08-09","07/08/2019","7","7435040"
"[NEAR LRT} Comfy & Spacious Master Room at SS2, Petaling Jaya","selangor","SS2, Petaling Jaya","RM 720.00","2019-08-09","07/08/2019","7","7435001"
"Middle Room at Casa Residenza, Kota Damansara","selangor","Casa Residenza, Kota Damansara","RM 750.00","2019-08-09","07/08/2019","7","7435010"
"Available Middle Room at Setia Alam. Near with Bandar Bukit Raja & Wifi","selangor","Setia Alam, Shah Alam","RM 550.00","2019-08-09","07/08/2019","7","7351922"
">Next to Bandar Bukit Raja >Single Room at Setia Alam, Shah Alam","selangor","Setia Alam, Shah Alam","RM 550.00","2019-08-09","07/08/2019","7","7374537"
"WIFI & Weekly Cleaning At USJ 1, Subang Jaya","selangor","USJ 1, UEP Subang Jaya","RM 630.00","2019-08-09","07/08/2019","7","7422491"
"Middle Room at Millennium Square, Petaling Jaya","selangor","Millennium Square, Petaling Jaya","RM 850.00","2019-08-09","07/08/2019","7","7434452"
"Bandar Puchong Jaya Available Room For Rent Near Industry With Full facilities & WIFI","selangor","Bandar Puchong Jaya, Puchong","RM 700.00","2019-08-09","07/08/2019","7","7349978"
"Cozy Middle Room at The Greens @ Subang West","selangor","Subang, Shah Alam","RM 750.00","2019-08-09","07/08/2019","7","7403495"
"Single Room at Shah Alam, Selangor","selangor","Shah Alam, Selangor","RM 450.00","2019-08-09","07/08/2019","7","7435000"
"Available Room Rent at Uptown Damansara Utama SS21 Nearby Starling Mall Uptown & WIFI","selangor","Damansara Utama, Petaling Jaya","RM 560.00","2019-08-09","07/08/2019","7","7396673"
"[50% DISCOUNT!!! LIMITED TIME OFFER ] Near to MRT/KTM Sungai Buloh, A Premium Single Room@ The Zizz,Damansara Damai,Petaling Jaya","selangor","Petaling Jaya, Selangor","RM 550.00","2019-08-09","07/08/2019","7","7429872"
"SS15 to Inti college its only 3 mins ! with HIGH SPEED WI-FI","selangor","SS15, Subang Jaya","RM 550.00","2019-08-09","07/08/2019","7","7423997"
"USJ Subang Near , Near With LRT With Free High Speed Wifi","selangor","UEP Subang Jaya, Subang Jaya","RM 580.00","2019-08-09","07/08/2019","7","7348074"
"Private toilet: Master room at SS19 Subang Jaya","selangor","Bandar Sunway, Petaling Jaya","RM 900.00","2019-08-09","07/08/2019","7","7368733"
"Available Middle Room At PJS 7, Bandar Sunway & High Speed Wi-fi","selangor","PJS 7, Bandar Sunway","RM 570.00","2019-08-09","07/08/2019","7","7382512"
"Premium Shared Room at Paramount Utropolis @ Glenmarie, Shah Alam","selangor","Paramount Utropolis @ Glenmarie, Shah Alam","RM 550.00","2019-08-09","07/08/2019","7","7434919"
"Master Room at Casa Residenza, Kota Damansara","selangor","Casa Residenza, Kota Damansara","RM 950.00","2019-08-09","07/08/2019","7","7435011"
"Single Room at Prima U1, Shah Alam","selangor","Prima U1, Shah Alam","RM 450.00","2019-08-09","07/08/2019","7","7435049"
"Single Room at The Regina, UEP Subang Jaya","selangor","The Regina, UEP Subang Jaya","RM 400.00","2019-08-09","07/08/2019","7","7435062"
"Room At Bandar Sunway, PJS 7 PJS 9 Near By Taylor's University With High Speed Wifi","selangor","PJS 7, Bandar Sunway","RM 550.00","2019-08-09","07/08/2019","7","7408256"
"Single Room at Hicom Glenmarie, Shah Alam","selangor","Hicom Glenmarie, Shah Alam","RM 350.00","2019-08-09","07/08/2019","7","7435025"
"Single Room at Pacific Place, Ara Damansara","selangor","Pacific Place, Ara Damansara","RM 650.00","2019-08-09","07/08/2019","7","7434962"
"Soho at The Square @ One City, UEP Subang Jaya","selangor","The Square @ One City, UEP Subang Jaya","RM 1700.00","2019-08-09","07/08/2019","7","7434820"
"Room For Rent at SS14 SUBANG,Walking distance to LRT SS18 With Wifi,","selangor","SS14, Subang Jaya","RM 580.00","2019-08-09","07/08/2019","7","7402930"
"Middle Room at SS2, Petaling Jaya","selangor","SS2, Petaling Jaya","RM 500.00","2019-08-09","07/08/2019","7","7434427"
"Master Room at Jasmine Towers, Petaling Jaya","selangor","Jasmine Towers, Petaling Jaya","RM 1100.00","2019-08-09","07/08/2019","7","7435051"
"Room For Rent At SS15, Near INTI College With Free Wi-fi","selangor","SS15, Subang Jaya","RM 550.00","2019-08-09","07/08/2019","7","7353638"
"Room For Rent With Full Facilities At Bandar Puteri Puchong, Near Industrial Park & Taman Wawasan","selangor","Bandar Puteri Puchong, Puchong","RM 530.00","2019-08-09","07/08/2019","7","7397781"
"Master Room at SS2, included Wifi, Cleanning & Utility Bill","selangor","SS2, Petaling Jaya","RM 800.00","2019-08-09","07/08/2019","7","7435023"
"Univ 360 Place Seri Kembangan Female Room For Rent, Nearby Taman Bukit Serdang Jaya, The Mines","selangor","Univ 360 Place, Seri Kembangan","RM 450.00","2019-08-09","07/08/2019","7","7434592"
"Room At Bandar Puteri Puchong & High Speed Internet","selangor","Bandar Puteri Puchong, Puchong","RM 600.00","2019-08-09","07/08/2019","7","7397877"
"Single Room at Taman Cahaya Apartment, Ampang","selangor","Bella Vista, Ampang","RM 420.00","2019-08-09","07/08/2019","7","7434658"
"Room Rent With Full Facilities at SS18 Subang,Nearby LRT Station [5Mins] With WiFi","selangor","SS18, Subang Jaya","RM 500.00","2019-08-09","07/08/2019","7","7401722"
"Middle Room at Seksyen 17, Petaling Jaya, Selangor nearby UM Damansara uptown Bandar Utama","selangor","Petaling Jaya, Selangor","RM 650.00","2019-08-09","07/08/2019","7","7434663"
"Middle Room at BK5, Bandar Kinrara With LRT STATION","selangor","BK5, Bandar Kinrara","RM 550.00","2019-08-09","07/08/2019","7","7432494"
"Furnished Unit Located Damansara Utama, Near UPTOWN, Starling With FREE 100Mbps WIFI","selangor","Damansara Utama, Petaling Jaya","RM 550.00","2019-08-09","07/08/2019","7","7401199"
"Full Facilities Available Room Rent SS15 Subang, Walking Distance Subang Square & With Wi-fi","selangor","SS15, Subang Jaya","RM 500.00","2019-08-09","07/08/2019","7","7396047"
"Middle Room own use toilet c/w air cond bill $490 @ jalan pjs10/1","selangor","Bandar Sunway, Petaling Jaya","RM 490.00","2019-08-09","07/08/2019","7","7434989"
"Single Room at BU3, Bandar Utama","selangor","BU3, Bandar Utama","RM 390.00","2019-08-09","07/08/2019","7","7433824"
"Single Room at SS15, Subang Jaya","selangor","SS15, Subang Jaya","RM 400.00","2019-08-09","07/08/2019","7","7435031"
"Middle Room At SS18, Subang Jaya With Cleaning Service, WIFI","selangor","SS18, Subang Jaya","RM 600.00","2019-08-09","07/08/2019","7","7421034"
"[ 50% DISCOUNT!!!] LIMITED ROOM: AFFORDABLE COMFY SINGLE ROOM AT THE ZIZZ, CONDOMINIUM. RENTAL INCLUDED UTILITIES","selangor","Petaling Jaya, Selangor","RM 550.00","2019-08-09","07/08/2019","7","7428684"
"Master Room at Seri Kembangan, Selangor (Red Ruby Shop Apartment)","selangor","Seri Kembangan, Selangor","RM 650.00","2019-08-09","07/08/2019","7","7435005"
"Single Room at Pacific Place, Ara Damansara, UTILITIES SUBSIDY, Citta mall, Subang Airport, Aegis, Oasis, ss2","selangor","Pacific Place, Ara Damansara","RM 750.00","2019-08-09","07/08/2019","7","7408619"
"Fully Furnish Room at SS21 UPTOWN Damansara Utama & High Speed WIFI","selangor","Damansara Utama, Petaling Jaya","RM 550.00","2019-08-09","07/08/2019","7","7371307"
"Single Room at Selangor, Malaysia","selangor","Selangor, Malaysia","RM 280.00","2019-08-09","07/08/2019","7","7392101"
"USJ Subang Middle Room For Rent, Near Da Men Mall, Summit With Wi-fi","selangor","UEP Subang Jaya, Subang Jaya","RM 590.00","2019-08-09","07/08/2019","7","7352000"
"Single Room at Section 19, Petaling Jaya","selangor","Section 19, Petaling Jaya","RM 800.00","2019-08-09","07/08/2019","7","7434737"
"FullY Furnished Medium Room at Wawasan , Bandar Puchong with Aircon & Free Wifi","selangor","Taman Wawasan, Pusat Bandar Puchong","RM 570.00","2019-08-09","07/08/2019","7","7350762"
"Middle Room at Zeva, Bandar Putra Permai","selangor","Zeva, Bandar Putra Permai","RM 780.00","2019-08-09","07/08/2019","7","7400044"
"Single Room at Semenyih, Selangor","selangor","Semenyih, Selangor","RM 550.00","2019-08-09","07/08/2019","7","7434535"
"Middle Room At Bukit Rimau, Shah Alam NEARBY Industrial Park, Kota Kemuning","selangor","Bukit Rimau, Shah Alam","RM 570.00","2019-08-09","07/08/2019","7","7425949"
