"Master Room at Platinum Lake PV13, Setapak","kuala_lumpur","Platinum Lake PV13, Setapak","RM 175.00","2019-08-09","08/08/2019","7","7435151"
"Middle Room at Kiara Residence 2, Bukit Jalil","kuala_lumpur","Kiara Residence 2, Bukit Jalil","RM 800.00","2019-08-09","08/08/2019","7","7435155"
"Middle Room at Parkhill Residence, Bukit Jalil","kuala_lumpur","Parkhill Residence, Bukit Jalil","RM 800.00","2019-08-09","08/08/2019","7","7381870"
"UCSI Uni Angkasa Condo Middle Room (fully furnished)","kuala_lumpur","Angkasa Condominiums, Cheras","RM 580.00","2019-08-09","08/08/2019","7","7413677"
"Aircon & WIFI Room Kepong Taman Fadason, Near AEON Metro Prima","kuala_lumpur","Kepong, Kuala Lumpur","RM 570.00","2019-08-09","08/08/2019","7","7352975"
"PV20 Condo Medium Room with A/C !!! Clean and Near PV128 !!!","kuala_lumpur","Platinum Lake PV20, Setapak","RM 500.00","2019-08-09","08/08/2019","7","7435132"
"Middle Room at Setapak, Kuala Lumpur","kuala_lumpur","Setapak, Kuala Lumpur","RM 550.00","2019-08-09","08/08/2019","7","7435344"
"Wangsa Maju (KL) Sek2 LRT","kuala_lumpur","Wangsa Maju, Setapak","RM 260.00","2019-08-09","08/08/2019","7","7435347"
"Single Room at Angkasa Condominiums, Cheras","kuala_lumpur","Angkasa Condominiums, Cheras","RM 400.00","2019-08-09","08/08/2019","7","7386141"
"For Mandarin speakers and Learners! From September, Master rooms next to LRT Universiti sta.","kuala_lumpur","Vista Angkasa, Pantai","RM 800.00","2019-08-09","08/08/2019","7","7434444"
"Room Rent Available Kepong, Taman Fadason Near MWE,Aeon Metro Prima & WI-FI","kuala_lumpur","Kepong, Kuala Lumpur","RM 550.00","2019-08-09","08/08/2019","7","7349193"
"Medium Room at Platinum Lake PV16, Setapak (facing PV128) available September","kuala_lumpur","Platinum Lake PV16, Setapak","RM 490.00","2019-08-09","08/08/2019","7","7399583"
"Middle Room at The Rainz, Bukit Jalil","kuala_lumpur","The Rainz, Bukit Jalil","RM 750.00","2019-08-09","08/08/2019","7","7420042"
"OUG PARKLANE Condo  Small Room","kuala_lumpur","Old Klang Road, Kuala Lumpur","RM 400.00","2019-08-09","08/08/2019","7","7435351"
"Master Room @ Rafflesia Sentul Near LRT Sentul Timur","kuala_lumpur","Sentul, Kuala Lumpur","RM 300.00","2019-08-09","08/08/2019","7","7435354"
"Middle Room at Bukit Jalil, Kuala Lumpur","kuala_lumpur","Bukit Jalil, Kuala Lumpur","RM 600.00","2019-08-09","08/08/2019","7","7435188"
"Cheras, Taman Connaught Near Cheras Sentral MAll, MRT Station, Giant, Ucsi University","kuala_lumpur","Cheras, Kuala Lumpur","RM 570.00","2019-08-09","08/08/2019","7","7425501"
"Master Room at Sri Petaling, Kuala Lumpur","kuala_lumpur","Sri Petaling, Kuala Lumpur","RM 800.00","2019-08-09","08/08/2019","7","7435186"
"Fully Furnished Middle Room (own bathroom, free car park) at Desa Green, Taman Desa","kuala_lumpur","Desa Green, Taman Desa","RM 750.00","2019-08-09","08/08/2019","7","7435115"
"Master Room at Seri Maya, Setiawangsa","kuala_lumpur","Seri Maya, Setiawangsa","RM 1200.00","2019-08-09","08/08/2019","7","7434605"
"WIFI & Aircon Middle Room Kepong, Taman Fadason","kuala_lumpur","Kepong, Kuala Lumpur","RM 570.00","2019-08-09","08/08/2019","7","7352280"
"VISTA KOMANWEL B SMALL ROOM FOR RENT","kuala_lumpur","Vista Komanwel, Bukit Jalil","RM 500.00","2019-08-09","08/08/2019","7","7435173"
"UCSI Uni Angkasa Condo Fully Furnished Master Room (Twin Sharing)","kuala_lumpur","Angkasa Condominiums, Cheras","RM 420.00","2019-08-09","08/08/2019","7","7413669"
"Middle Room at Platinum Lake PV21, Setapak","kuala_lumpur","Platinum Lake PV21, Setapak","RM 500.00","2019-08-09","08/08/2019","7","7435187"
"Master Room @ Walk to MRT + LRT (Full Furnish + Air Cond + Wifi)","kuala_lumpur","Taman Maluri, Cheras","RM 1190.00","2019-08-09","08/08/2019","7","7415137"
"Single Room at The Rainz, Bukit Jalil","kuala_lumpur","The Rainz, Bukit Jalil","RM 550.00","2019-08-09","08/08/2019","7","7420048"
"Studio at 10 Semantan, Damansara Heights","kuala_lumpur","10 Semantan, Damansara Heights","RM 1800.00","2019-08-09","08/08/2019","7","7435249"
"Single Room at Sg Long","kuala_lumpur","Permata Residences, Cheras","RM 299.00","2019-08-09","08/08/2019","7","7433122"
"Middle Room at Seri Maya, Setiawangsa","kuala_lumpur","Seri Maya, Setiawangsa","RM 850.00","2019-08-09","08/08/2019","7","7434617"
"Middle Room at Pelangi Indah, Jalan Ipoh; SEPTEMBER Intake","kuala_lumpur","Pelangi Indah, Jalan Ipoh","RM 500.00","2019-08-09","08/08/2019","7","7395494"
"Middle Room at Taman Kepong, Kepong","kuala_lumpur","Taman Kepong, Kepong","RM 300.00","2019-08-09","08/08/2019","7","7435284"
"F/F Large Room available near KL/Nu Sentral","kuala_lumpur","Brickfields, KL City Centre","RM 1100.00","2019-08-09","08/08/2019","7","7435123"
"Master Room at Midfields, Sungai Besi, Cheras","kuala_lumpur","Midfields, Sungai Besi","RM 850.00","2019-08-09","08/08/2019","7","7435325"
"Great Location!!! At Cheras with Free WIFI Don't Miss!","kuala_lumpur","Taman Connaught, Cheras","RM 550.00","2019-08-09","08/08/2019","7","7352021"
"Middle Room at Setapak, Kuala Lumpur","kuala_lumpur","Setapak, Kuala Lumpur","RM 400.00","2019-08-09","08/08/2019","7","7434917"
"Master Room at Taman Sungai Besi, Sungai Besi","kuala_lumpur","Taman Sungai Besi, Sungai Besi","RM 450.00","2019-08-09","08/08/2019","7","7415937"
"Middle Room Available for Rent at Desa Putra Condo - Near to LRT Only 1 min Walking Distance","kuala_lumpur","Desa Putra, Wangsa Maju","RM 800.00","2019-08-09","08/08/2019","7","7435139"
"Middle Room at Royal Regent (Dutamas, near Mont Kiara) - Available from Sep 2019","kuala_lumpur","Royal Regent, Jalan Kuching, Dutamas","RM 700.00","2019-08-09","08/08/2019","7","7434371"
"Master Room at PPA1M Bukit Jalil, Kuala Lumpur","kuala_lumpur","Bukit Jalil, Kuala Lumpur","RM 800.00","2019-08-09","08/08/2019","7","7403330"
"Master Room at Vista Angkasa, Pantai","kuala_lumpur","Vista Angkasa, Pantai","RM 250.00","2019-08-09","08/08/2019","7","7434874"
"Small room with own toilet at 288 Residences","kuala_lumpur","Kuchai Lama, Kuala Lumpur","RM 550.00","2019-08-09","08/08/2019","7","7435250"
"Big Room To Let at Setapak","kuala_lumpur","Setapak, Kuala Lumpur","RM 550.00","2019-08-09","08/08/2019","7","7435207"
"Single Room at Pelangi Indah, Jalan Ipoh; SEPTEMBER Intake","kuala_lumpur","Pelangi Indah, Jalan Ipoh","RM 370.00","2019-08-09","08/08/2019","7","7387460"
"Angkasa Condo UCSI (All-Female Housemate) Middle Bedroom","kuala_lumpur","Angkasa Condominiums, Cheras","RM 580.00","2019-08-09","08/08/2019","7","7387516"
"Middle Room at Sentul, Kuala Lumpur","kuala_lumpur","Sentul, Kuala Lumpur","RM 450.00","2019-08-09","08/08/2019","7","7435169"
"Medium Room with Queen Bed near MRT, EY, DC Mall, Bangsar, Kuala Lumpur","kuala_lumpur","Bangsar, Kuala Lumpur","RM 750.00","2019-08-09","08/08/2019","7","7403273"
"Middle Room at Bayu Tasik 1, Bandar Sri Permaisuri","kuala_lumpur","Bayu Tasik 1, Bandar Sri Permaisuri","RM 450.00","2019-08-09","08/08/2019","7","7435080"
"Middle Room at 288 Residences, Kuchai Lama","kuala_lumpur","288 Residences, Kuchai Lama","RM 800.00","2019-08-09","08/08/2019","7","7435108"
"Middle Room at Platinum Hill PV2, Setapak","kuala_lumpur","Platinum Hill PV2, Setapak","RM 450.00","2019-08-09","08/08/2019","7","7435244"
"Middle Room at Kepong, Kuala Lumpur","kuala_lumpur","Kepong, Kuala Lumpur","RM 400.00","2019-08-09","08/08/2019","7","7435138"
"Medium Room at Platinum Lake PV15, Setapak (Available in September)","kuala_lumpur","Platinum Lake PV15, Setapak","RM 450.00","2019-08-09","08/08/2019","7","7435329"
"Single Room at Pantai Hillpark 5, Pantai","kuala_lumpur","Pantai Hillpark 5, Pantai","RM 400.00","2019-08-09","08/08/2019","7","7435143"
"Master Room at Vista Angkasa, Pantai","kuala_lumpur","Vista Angkasa, Pantai","RM 260.00","2019-08-09","08/08/2019","7","7435219"
"Middle Room at Wangsa Maju, Setapak","kuala_lumpur","Wangsa Maju, Setapak","RM 700.00","2019-08-09","08/08/2019","7","7435200"
"Master Room@The Rainz at Bukit Jalil, Kuala Lumpur","kuala_lumpur","Bukit Jalil, Kuala Lumpur","RM 1150.00","2019-08-09","08/08/2019","7","7430734"
"Master Room at Cheras, Kuala Lumpur","kuala_lumpur","Cheras, Kuala Lumpur","RM 900.00","2019-08-09","08/08/2019","7","7435331"
"Master Room at Taman Usahawan, Kepong","kuala_lumpur","Taman Usahawan, Kepong","RM 300.00","2019-08-09","08/08/2019","7","7434691"
"Master Room at Anyaman Residence, Sungai Besi","kuala_lumpur","Anyaman Residence, Sungai Besi","RM 800.00","2019-08-09","08/08/2019","7","7435234"
"M3 Residency - Fully Furnished Aircond BIG Middle Room!!! Offer Price RM600!!!","kuala_lumpur","Setapak, Kuala Lumpur","RM 600.00","2019-08-09","08/08/2019","7","7420582"
"Vista Komanwel B Middle Room FEMALE UNIT","kuala_lumpur","Vista Komanwel, Bukit Jalil","RM 650.00","2019-08-09","08/08/2019","7","7435183"
"Master Room at Wangsa Maju, Setapak","kuala_lumpur","Wangsa Maju, Setapak","RM 240.00","2019-08-09","08/08/2019","7","7435191"
"Master Room at Pelangi Indah, Jalan Ipoh; SEPTEMBER Intake","kuala_lumpur","Pelangi Indah, Jalan Ipoh","RM 700.00","2019-08-09","08/08/2019","7","7395502"
"Middle Room, Personal Washroom, Free Wifi (Villa Puteri Condominium) next to PWTC LRT Station, KTM Putra Station & Sunway Putra Mall","kuala_lumpur","Villa Puteri, Putra","RM 950.00","2019-08-09","08/08/2019","7","7434826"
"Middle Room FOR Rent At Mutiara Bukit Jalil with Internet,Aircon & Stretagic Location","kuala_lumpur","Bukit Jalil, Kuala Lumpur","RM 660.00","2019-08-09","08/08/2019","7","7383694"
"Comfortable Medium Room near Bangsar and MRT, Kuala Lumpur","kuala_lumpur","Bangsar, Kuala Lumpur","RM 700.00","2019-08-09","08/08/2019","7","7435258"
"Single Room at Endah Regal, Sri Petaling","kuala_lumpur","Endah Regal, Sri Petaling","RM 400.00","2019-08-09","08/08/2019","7","7435309"
"Master Room@Walk to MRT + LRT (Fully Furnish + Air Cond + Wifi)","kuala_lumpur","Amaya Maluri, Cheras","RM 1190.00","2019-08-09","08/08/2019","7","7415133"
"Middle Room at Sky Awani Residensi, Sentul","kuala_lumpur","Sky Awani Residensi, Sentul","RM 500.00","2019-08-09","08/08/2019","7","7431193"
"Middle Room at Seri Maya, Setiawangsa","kuala_lumpur","Seri Maya, Setiawangsa","RM 850.00","2019-08-09","08/08/2019","7","7434619"
"Master Room at Endah Regal, Sri Petaling","kuala_lumpur","Endah Regal, Sri Petaling","RM 650.00","2019-08-09","08/08/2019","7","7435314"
"Master Room at South View, Bangsar South","kuala_lumpur","South View, Bangsar South","RM 1300.00","2019-08-09","08/08/2019","7","7435194"
"Middle Room at Pantai Permai 11, Desa aman, Pantai dalam, Kuala Lumpur","kuala_lumpur","Pantai, Kuala Lumpur","RM 750.00","2019-08-09","08/08/2019","7","7377077"
"WI-FI & AC Middle Room Rent Kepong At Taman Fadason,Near Metro Prima & Taman Usahawan","kuala_lumpur","Kepong, Kuala Lumpur","RM 550.00","2019-08-09","08/08/2019","7","7372261"
"Middle Room at Desa Green, Taman Desa","kuala_lumpur","Desa Green, Taman Desa","RM 780.00","2019-08-09","08/08/2019","7","7434484"
"Single Room near LRT Awan Besar","kuala_lumpur","Bukit OUG Condominium, Bukit Jalil","RM 299.00","2019-08-09","08/08/2019","7","7435227"
"Sharing Room at Pelangi Indah, Jalan Ipoh; SEPTEMBER Intake","kuala_lumpur","Pelangi Indah, Jalan Ipoh","RM 300.00","2019-08-09","08/08/2019","7","7395497"
"Small Room at Platinum Hill PV2, Setapak","kuala_lumpur","Platinum Hill PV2, Setapak","RM 400.00","2019-08-09","08/08/2019","7","7435252"
"READY TO MOVE IN Middle Room at Menara Duta 2, Dutamas","kuala_lumpur","Menara Duta 2, Dutamas","RM 650.00","2019-08-09","08/08/2019","7","7432013"
"Middle Room with Balcony at Pelangi Indah, Jalan Ipoh; SEPTEMBER intake","kuala_lumpur","Pelangi Indah, Jalan Ipoh","RM 500.00","2019-08-09","08/08/2019","7","7395510"
"Medium room to rent @ Kiara Residence 1 -- move in immediately","kuala_lumpur","Bukit Jalil, Kuala Lumpur","RM 600.00","2019-08-09","08/08/2019","7","6598510"
"Middle Room at Endah Regal, Sri Petaling","kuala_lumpur","Endah Regal, Sri Petaling","RM 450.00","2019-08-09","08/08/2019","7","7435312"
"Vista Komanwel B master room male unit","kuala_lumpur","Vista Komanwel, Bukit Jalil","RM 850.00","2019-08-09","08/08/2019","7","7435179"
"Big Medium Room at Platinum Lake PV15, Setapak","kuala_lumpur","Platinum Lake PV15, Setapak","RM 500.00","2019-08-09","08/08/2019","7","7435264"
"Single Room at Pelangi Indah, Jalan Ipoh; SEPTEMBER Intake","kuala_lumpur","Pelangi Indah, Jalan Ipoh","RM 390.00","2019-08-09","08/08/2019","7","7395507"
"Middle Room at Sri Petaling, Kuala Lumpur","kuala_lumpur","Sri Petaling, Kuala Lumpur","RM 500.00","2019-08-09","08/08/2019","7","7435185"
"Mid Floor Middle Room at Bukit Ceylon, KL City Centre","kuala_lumpur","Bukit Ceylon, KL City Centre","RM 1050.00","2019-08-09","07/08/2019","7","7360893"
"Spacious Middle Room at Bukit Ceylon, KL City Centre","kuala_lumpur","Bukit Ceylon, KL City Centre","RM 1000.00","2019-08-09","07/08/2019","7","7392204"
"Middle Room at OUG Parklane, Old Klang Road","kuala_lumpur","OUG Parklane, Old Klang Road","RM 580.00","2019-08-09","07/08/2019","7","7431325"
"PV20 Condo Setapak KL Medium Bedroom with Private Balcony [Facing KLCC City View]","kuala_lumpur","Platinum Lake PV20, Setapak","RM 480.00","2019-08-09","07/08/2019","7","7435050"
"Single Room at Bandar Tasik Selatan, Cheras","kuala_lumpur","Bandar Tasik Selatan, Cheras","RM 330.00","2019-08-09","07/08/2019","7","7434587"
"Master Room at Cheras, Kuala Lumpur","kuala_lumpur","Cheras, Kuala Lumpur","RM 650.00","2019-08-09","07/08/2019","7","7434731"
"Middle Room at Lakeville Residence, Jalan Ipoh","kuala_lumpur","Lakeville Residence, Jalan Ipoh","RM 550.00","2019-08-09","07/08/2019","7","7435078"
"Single Room at Central Residence, Sungai Besi","kuala_lumpur","Central Residence, Sungai Besi","RM 500.00","2019-08-09","07/08/2019","7","7435114"
"Nice PV20 Medium Rooms, Move in Aug 2019","kuala_lumpur","Platinum Lake PV20, Setapak","RM 500.00","2019-08-09","07/08/2019","7","7435100"
"Single Room at Riverville Residences, Old Klang Road","kuala_lumpur","Riverville Residences, Old Klang Road","RM 950.00","2019-08-09","07/08/2019","7","7435068"
"Single Room at 288 Residences, Kuchai Lama","kuala_lumpur","288 Residences, Kuchai Lama","RM 550.00","2019-08-09","07/08/2019","7","7435116"
"Available Room For Rent with Private bathroom at Bukit Jalil, with Aircon & WIFI Near LRT","kuala_lumpur","Bukit Jalil, Kuala Lumpur","RM 660.00","2019-08-09","07/08/2019","7","7347814"
"Master Room at Riverville Residences, Old Klang Road","kuala_lumpur","Riverville Residences, Old Klang Road","RM 1100.00","2019-08-09","07/08/2019","7","7435060"
"Putra Court, 1 min LRT PWTC, IUMW, Sunway Putra Mall, Very Clean & Safe!","kuala_lumpur","Kuala Lumpur, Malaysia","RM 700.00","2019-08-09","07/08/2019","7","7433709"
"PV12 Condo Above MYDIN Furnish Medium Room [Near Setapak Central Mall] Walking Distance","kuala_lumpur","Platinum Lake PV12, Setapak","RM 500.00","2019-08-09","07/08/2019","7","7435071"
"Single Room at Riverville Residences, Old Klang Road","kuala_lumpur","Riverville Residences, Old Klang Road","RM 550.00","2019-08-09","07/08/2019","7","7435104"
"Bukit Jalil, The Andes Condo (INCLUDING UTILITIES, WIFI)","kuala_lumpur","The Andes, Bukit Jalil","RM 800.00","2019-08-09","07/08/2019","7","7434629"
"Middle Room at Anggun Puri, Dutamas","kuala_lumpur","Anggun Puri, Dutamas","RM 550.00","2019-08-09","07/08/2019","7","7435003"
"Middle Room at Platinum Lake PV20, Setapak","kuala_lumpur","Platinum Lake PV20, Setapak","RM 550.00","2019-08-09","07/08/2019","7","7388004"
"URGENT - Middle Room at South View, Bangsar South (Sharing) - 1st Sep move in","kuala_lumpur","South View, Bangsar South","RM 600.00","2019-08-09","07/08/2019","7","7435007"
"Studio at Jalan Medang Serai, Bukit Bandaraya, Bangsar, Kuala Lumpur","kuala_lumpur","Bangsar, Kuala Lumpur","RM 750.00","2019-08-09","07/08/2019","7","7434660"
"Medium Room C/W Bed, For Rent at J.Dupion, Cheras (Covered Linking Bridge to Taman Pertama MRT)","kuala_lumpur","J.Dupion, Cheras","RM 800.00","2019-08-09","07/08/2019","7","7434857"
"Single Room at Bangsar, Kuala Lumpur","kuala_lumpur","Bangsar, Kuala Lumpur","RM 550.00","2019-08-09","07/08/2019","7","7395227"
"Middle Room at Mid Valley City, KL City Centre","kuala_lumpur","Mid Valley City, KL City Centre","RM 700.00","2019-08-09","07/08/2019","7","7396803"
"PV20 Medium Room for Rent !!","kuala_lumpur","Setapak, Kuala Lumpur","RM 550.00","2019-08-09","07/08/2019","7","7342367"
"Single Room at Riverville Residences, Old Klang Road","kuala_lumpur","Riverville Residences, Old Klang Road","RM 500.00","2019-08-09","07/08/2019","7","7435077"
"The CapSquare Residences (Room 8)","kuala_lumpur","Kuala Lumpur, Malaysia","RM 690.00","2019-08-09","07/08/2019","7","7414635"
"Single Room at Taman Connaught, Cheras","kuala_lumpur","Taman Connaught, Cheras","RM 400.00","2019-08-09","07/08/2019","7","7370883"
"Fully FURNISHED with UTILITIES RM460 @ Menara Megah Condo, Jalan Ipoh, Sentul, KL City Centre","kuala_lumpur","Jalan Ipoh, Kuala Lumpur","RM 460.00","2019-08-09","07/08/2019","7","7435039"
"Master Room at Bandar Sri Permaisuri, Cheras","kuala_lumpur","Bandar Sri Permaisuri, Cheras","RM 650.00","2019-08-09","07/08/2019","7","7435058"
"Middle Room at Platinum Lake PV20, Setapak","kuala_lumpur","Platinum Lake PV20, Setapak","RM 500.00","2019-08-09","07/08/2019","7","7435017"
"New, clean & furnished Middle Room at South View, Bangsar South","kuala_lumpur","South View, Bangsar South","RM 1590.00","2019-08-09","07/08/2019","7","7430191"
"Middle Room at Platinum Hill PV2, Setapak","kuala_lumpur","Platinum Hill PV2, Setapak","RM 400.00","2019-08-09","07/08/2019","7","7434978"
"Single Room at Wangsa Maju, Setapak","kuala_lumpur","Wangsa Maju, Setapak","RM 450.00","2019-08-09","07/08/2019","7","7412066"
"[NEW] Beautiful Medium Balcony Room for Rent @ Danau Kota Suites near to TARC, Columbia Hospital & Setapak Central","kuala_lumpur","Danau Kota, Setapak","RM 950.00","2019-08-09","07/08/2019","7","7434534"
"Near Midvalley, KL Central Fully Furnished Aircond room","kuala_lumpur","Taman Desa, Kuala Lumpur","RM 550.00","2019-08-09","07/08/2019","7","7383230"
"Single Room at Platinum Lake PV20, Setapak","kuala_lumpur","Platinum Lake PV20, Setapak","RM 450.00","2019-08-09","07/08/2019","7","7388008"
"Middle Room at Bandar Sri Permaisuri, Cheras","kuala_lumpur","Bandar Sri Permaisuri, Cheras","RM 550.00","2019-08-09","07/08/2019","7","7434757"
"Middle Room at Sri Petaling, Kuala Lumpur","kuala_lumpur","Endah Villa, Sri Petaling","RM 550.00","2019-08-09","07/08/2019","7","7413020"
"Available Room Rent At Mutiara Bukit Jalil , Kuala Lumpur & 100Mbps High Speed Wi-fi","kuala_lumpur","Bukit Jalil, Kuala Lumpur","RM 650.00","2019-08-09","07/08/2019","7","7380690"
"Middle Room at Cheras, Kuala Lumpur","kuala_lumpur","Cheras, Kuala Lumpur","RM 600.00","2019-08-09","07/08/2019","7","7434802"
"Air-Conditioned Master Room at Bandar Sri Permaisuri (Move in end of Aug)","kuala_lumpur","Bandar Sri Permaisuri, Cheras","RM 650.00","2019-08-09","07/08/2019","7","7433917"
"Middle Room at Sentul Village, Sentul","kuala_lumpur","Sentul Village, Sentul","RM 500.00","2019-08-09","07/08/2019","7","7379545"
"Big Medium Room with Private Balcony at Wangsa Metroview","kuala_lumpur","Wangsa Maju, Setapak","RM 550.00","2019-08-09","07/08/2019","7","7434829"
"Middle Room at Platinum Lake PV20, Setapak","kuala_lumpur","Platinum Lake PV20, Setapak","RM 550.00","2019-08-09","07/08/2019","7","7434544"
"Master Room C/W Bed, For Rent at J.Dupion, Cheras (Covered Linking Bridge to Taman Pertama MRT)","kuala_lumpur","J.Dupion, Cheras","RM 1200.00","2019-08-09","07/08/2019","7","7404138"
"Master Room at Titiwangsa Sentral, Titiwangsa","kuala_lumpur","Titiwangsa Sentral, Titiwangsa","RM 1100.00","2019-08-09","07/08/2019","7","7434950"
"Near Midvalley, KL central Fully Furnished Big room ( 2 person can share )","kuala_lumpur","Taman Desa, Kuala Lumpur","RM 630.00","2019-08-09","07/08/2019","7","7384792"
"Most Convenient New Designer Middle Room at KLCC","kuala_lumpur","Mercu Summer Suites, KLCC","RM 1400.00","2019-08-09","07/08/2019","7","7410008"
"Single Room at Taman Sri Bintang, Kepong","kuala_lumpur","Taman Sri Bintang, Kepong","RM 400.00","2019-08-09","07/08/2019","7","7434878"
"BILIK LELAKI BUKIT ANGKASA BANGSAR SOUTH. OGOS. SEPT.","kuala_lumpur","Bangsar South, Pantai","RM 320.00","2019-08-09","07/08/2019","7","7433408"
"Middle Room at Kiara Residence, Bukit Jalil","kuala_lumpur","Kiara Residence, Bukit Jalil","RM 750.00","2019-08-09","07/08/2019","7","7434937"
"Middle Room at Platinum Lake PV20, Setapak","kuala_lumpur","Platinum Lake PV20, Setapak","RM 550.00","2019-08-09","07/08/2019","7","7435036"
"Master Room at Sentul, Kuala Lumpur","kuala_lumpur","Menara Orkid, Sentul","RM 200.00","2019-08-09","07/08/2019","7","7435024"
"Master Room at Old Klang Road, Kuala Lumpur","kuala_lumpur","Old Klang Road, Kuala Lumpur","RM 700.00","2019-08-09","07/08/2019","7","7434947"
"Middle Room at Kepong Baru, Kepong","kuala_lumpur","Kepong Baru, Kepong","RM 650.00","2019-08-09","07/08/2019","7","7434903"
"Middle Room at Menara Alpha, Wangsa Maju","kuala_lumpur","Menara Alpha, Wangsa Maju","RM 400.00","2019-08-09","07/08/2019","7","7434543"
"Middle Room at 288 Residences with Parking","kuala_lumpur","288 Residences, Kuchai Lama","RM 650.00","2019-08-09","07/08/2019","7","7434094"
"Master Room at Sri Petaling, Kuala Lumpur","kuala_lumpur","Sri Petaling, Kuala Lumpur","RM 1100.00","2019-08-09","07/08/2019","7","7434551"
"Middle Room at Taman Dato Senu, Sentul","kuala_lumpur","Taman Dato Senu, Sentul","RM 280.00","2019-08-09","07/08/2019","7","7435020"
"Master Room at Bukit Bintang, KL City Centre","kuala_lumpur","Bukit Bintang, KL City Centre","RM 1250.00","2019-08-09","07/08/2019","7","7417558"
"F/F Master Room ?Free Car Park ?A/C","kuala_lumpur","Bukit Jalil, Kuala Lumpur","RM 780.00","2019-08-09","07/08/2019","7","5582445"
"Middle Room at Titiwangsa Sentral, Titiwangsa","kuala_lumpur","Titiwangsa Sentral, Titiwangsa","RM 850.00","2019-08-09","07/08/2019","7","7434930"
"PV13 Big Medium room???????","kuala_lumpur","Platinum Lake PV13, Setapak","RM 680.00","2019-08-09","07/08/2019","7","7430646"
"Single Room at Setapak, Kuala Lumpur","kuala_lumpur","Setapak, Kuala Lumpur","RM 300.00","2019-08-09","07/08/2019","7","7434786"
"TTDI Kuala Lumpur Room For Rent, with Free High Speed WI-FI","kuala_lumpur","TTDI, Kuala Lumpur","RM 560.00","2019-08-09","07/08/2019","7","7371800"
"NEW Fully Furnished Single/Master Room For Rent IMU Student / APU Student @ Vista Komanwel Tower C","kuala_lumpur","Vista Komanwel, Bukit Jalil","RM 680.00","2019-08-09","07/08/2019","7","7434299"
"Master Room at Taman OUG, Old Klang Road","kuala_lumpur","Taman OUG, Old Klang Road","RM 700.00","2019-08-09","07/08/2019","7","7365613"
"Middle Room at Pantai Hillpark 5, Pantai","kuala_lumpur","Pantai Hillpark 5, Pantai","RM 550.00","2019-08-09","07/08/2019","7","7434612"
"Single Room at Wisma Cosway, KLCC","kuala_lumpur","Wisma Cosway, KLCC","RM 700.00","2019-08-09","07/08/2019","7","7433387"
"Single Room at Old Klang Road, Kuala Lumpur","kuala_lumpur","Old Klang Road, Kuala Lumpur","RM 400.00","2019-08-09","07/08/2019","7","7434952"
"Single Room at Seri Maya, Setiawangsa","kuala_lumpur","Seri Maya, Setiawangsa","RM 650.00","2019-08-09","07/08/2019","7","7434615"
"Middle Room At TTDI, Kuala Lumpur With 100MBPS MRT STATION","kuala_lumpur","TTDI, Kuala Lumpur","RM 630.00","2019-08-09","07/08/2019","7","7432492"
"Middle Room at Bukit Gembira Apartment, Kuchai Lama","kuala_lumpur","Bukit Gembira Apartment, Kuchai Lama","RM 600.00","2019-08-09","07/08/2019","7","7433696"
"Bukit Jalil, The Andes Condo (INCLUDING UTILITIES, WIFI)","kuala_lumpur","The Andes, Bukit Jalil","RM 600.00","2019-08-09","07/08/2019","7","7434625"
"D'Alamanda Condo Big Room (Near Maluri LRT/MRT Station) Cheras","kuala_lumpur","Cheras, Kuala Lumpur","RM 750.00","2019-08-09","07/08/2019","7","2708373"
"Middle Room at Taman Desa Jaya, Kepong","kuala_lumpur","Taman Desa Jaya, Kepong","RM 380.00","2019-08-09","07/08/2019","7","7434990"
"Studio at Dorchester, Sri Hartamas","kuala_lumpur","Dorchester, Sri Hartamas","RM 1400.00","2019-08-09","07/08/2019","7","7413634"
"?? Middle Room ? Free car park ? Fully furnished ?","kuala_lumpur","OUG Parklane, Old Klang Road","RM 650.00","2019-08-09","07/08/2019","7","7431346"
"[NEW] Beautiful Room for Rent @ Danau Kota Suites near to TARC, Columbia Hospital & Setapak Central","kuala_lumpur","Danau Kota, Setapak","RM 600.00","2019-08-09","07/08/2019","7","7434533"
"1 minutes walk to Cheras LRT Station Single Room at Bandar Sri Permaisuri, Cheras","kuala_lumpur","Bandar Sri Permaisuri, Cheras","RM 450.00","2019-08-09","07/08/2019","7","7434748"
"Single Room at The Nest Residences, Old Klang Road","kuala_lumpur","The Nest Residences, Old Klang Road","RM 550.00","2019-08-09","07/08/2019","7","7434806"
"Middle Room at 288 Residences, Kuchai Lama","kuala_lumpur","288 Residences, Kuchai Lama","RM 800.00","2019-08-09","07/08/2019","7","7434600"
"Middle Room at Platinum Hill PV3, Setapak","kuala_lumpur","Platinum Hill PV3, Setapak","RM 450.00","2019-08-09","07/08/2019","7","7434968"
"Single Room at Casa Green, Bukit Jalil. Utility, Internet, Cleaning Services is Included.","kuala_lumpur","Casa Green, Bukit Jalil","RM 600.00","2019-08-09","07/08/2019","7","7434938"
"Middle Room at Lorong Jaya 14, Bandar Tun Razak, Cheras","kuala_lumpur","Bandar Tun Razak, Cheras","RM 600.00","2019-08-09","07/08/2019","7","7377068"
"Single Room at Fortune Perdana Lakeside, Kepong","kuala_lumpur","Fortune Perdana Lakeside, Kepong","RM 300.00","2019-08-09","07/08/2019","7","7434372"
"Middle Room at Bangsar, Kuala Lumpur","kuala_lumpur","Bangsar, Kuala Lumpur","RM 750.00","2019-08-09","07/08/2019","7","7433172"
"Middle Room at Wangsa Metroview, Wangsa Maju","kuala_lumpur","Wangsa Metroview, Wangsa Maju","RM 500.00","2019-08-09","07/08/2019","7","7434843"
